fname,media_id,url,clarifai_labels,google_labels
1530861_236242536554916_1966493831_n,702714441,https://scontent.cdninstagram.com/hphotos-xap1/t51.2885-15/e15/1530861_236242536554916_1966493831_n.jpg,group  people  portrait  man  adult  facial expression  group together  music  three  four  leader  several  two  wear  administration  musician  woman  five  theater  election,people
1799842_662247697154774_1850247866_n,702714442,https://scontent.cdninstagram.com/hphotos-xap1/t51.2885-15/e15/1799842_662247697154774_1850247866_n.jpg,people  woman  adult  stock  one  shopping  city  street  man  shop  portrait  commerce  market  indoors  business  sit  wear  group  sale  vehicle,art  collage  poster  comic book  brand  comics  album cover  photomontage
928242_661258293947406_1342041069_n,702714444,https://scontent.cdninstagram.com/hphotos-xap1/t51.2885-15/e15/928242_661258293947406_1342041069_n.jpg,fashion  no person  wear  cotton  casual  textile  business  scissors  elegant  sewing  yarn  shopping  luxury  garment  accessory  isolated  woman  indoors  leisure  design,blue  clothing  footwear  art  t shirt  glasses  spring  brand  pattern  design  handbag  textile  shoe
1941243_1406565976268371_1914385969_n,702714447,https://scontent.cdninstagram.com/hphotos-xap1/t51.2885-15/e15/1941243_1406565976268371_1914385969_n.jpg,woman  people  adult  one  portrait  girl  hair  man  fashion  blond  model  indoors  elderly  studio  child  wear  sit  sadness  face  grief,hair  hairstyle  hair coloring  long hair  braid  brown hair  bun  chignon
10471856_308980365932988_795846006_n,702714448,https://scontent.cdninstagram.com/hphotos-xpf1/t51.2885-15/e15/10471856_308980365932988_795846006_n.jpg,beach  recreation  tropical  palm  people  leisure  travel  sand  vacation  resort  relaxation  ocean  seashore  summer  woman  girl  sun  lifestyle  adult  man,sports  physical fitness  dance
10268937_1450527935191994_1395259691_n,702714450,https://scontent.cdninstagram.com/hphotos-xfp1/t51.2885-15/e15/10268937_1450527935191994_1395259691_n.jpg,baseball  people  man  one  portrait  wear  lid  uniform  adult  urban  cap  outfit  business  safety  bench  athlete  outdoors  helmet  competition  baseball bat,person  clothing
10358197_1512726538948563_540437260_n,702714456,https://scontent.cdninstagram.com/hphotos-xfp1/t51.2885-15/e15/10358197_1512726538948563_540437260_n.jpg,indoors  sitting  man  sit  technology  adult  computer  people  seat  healthcare  woman  internet  relaxation  room  connection  chair  office  furniture  looking  business,person  human positions  sitting  professional  profession
1515870_1391445037774547_444501278_n,702714458,https://scontent.cdninstagram.com/hphotos-xaf1/t51.2885-15/e15/1515870_1391445037774547_444501278_n.jpg,mammal  portrait  dog  animal  wildlife  no person  cute  canine  one  face  nature  symbol  food  facial expression  looking  nose  eye  side view  fur  carnivore,dog  mammal  dog breed  nose  vertebrate  shiba inu  dog breed group  dog like mammal
1171914_780164315333604_808138638_n,702714459,https://scontent.cdninstagram.com/hphotos-xfp1/t51.2885-15/e15/1171914_780164315333604_808138638_n.jpg,people  room  indoors  museum  adult  group  exhibition  recreation  furniture  wear  performance  man  music  portrait  commerce  festival  home  woman  dancing  light,image  art  tourist attraction  art exhibition
1597999_349620035177362_1662644676_n,702714463,https://scontent.cdninstagram.com/hphotos-xpa1/t51.2885-15/e15/1597999_349620035177362_1662644676_n.jpg,lid  man  people  vertical  portrait  adult  headwear  flag  patriotism  cap  serious  pride  wear  uniform  identity  beard  fun  mustache  humor  headshot,clothing  cap  head  baseball cap  fashion accessory  hat  headgear  costume hat  costume accessory
10175257_264887690360940_1981763947_n,702714472,https://scontent.cdninstagram.com/hphotos-xfp1/t51.2885-15/e15/10175257_264887690360940_1981763947_n.jpg,girl  people  portrait  woman  adult  indoors  one  child  family  happiness  smile  hair  fun  face  facial expression  brunette  leisure  beautiful  model  music,hair  facial expression  face  person  nose  woman  glasses  lady  blond  girl  hairstyle  smile  vision care  mouth  head  organ  eye  portrait  emotion  human body
10431992_505298762905689_649626357_n,702714480,https://scontent.cdninstagram.com/hphotos-xpa1/t51.2885-15/e15/10431992_505298762905689_649626357_n.jpg,woman  people  adult  two  portrait  wear  love  indoors  man  girl  family  happiness  young  togetherness  business  fashion  lifestyle  education  outdoors  beautiful,clothing  lady  girl  blond  fashion  leg  model  interaction  photo shoot  hug
1171919_610098042384117_376463511_n,702714482,https://scontent.cdninstagram.com/hphotos-xpf1/t51.2885-15/e15/1171919_610098042384117_376463511_n.jpg,people  one  adult  woman  man  wear  child  portrait  recreation  healthcare  girl  art  painting  music  toy  strange  group  medicine  indoors  room,image  painting
1170256_645785642165546_569827790_n,702714484,https://scontent.cdninstagram.com/hphotos-xpa1/t51.2885-15/e15/1170256_645785642165546_569827790_n.jpg,people  portrait  illustration  bill  paper  retro  print  vintage  adult  woman  post  collection  communication  vertical  sign  person  business  spherical  symbol  man,poster  advertising  presentation
10261284_796620677022369_463282370_n,702714487,https://scontent.cdninstagram.com/hphotos-xfp1/t51.2885-15/e15/10261284_796620677022369_463282370_n.jpg,color  decoration  traditional  celebration  no person  bright  festival  desktop  souvenir  motley  party  pattern  culture  wear  design  coloring  handmade  ceremony  symbol  summer,clothing  fashion accessory  art  pattern
10472063_243161512547349_1489897310_n,702714488,https://scontent.cdninstagram.com/hphotos-xpf1/t51.2885-15/e15/10472063_243161512547349_1489897310_n.jpg,dog  pet  puppy  cute  animal  canine  domestic  adorable  little  purebred  breed  pedigree  mammal  whelp  downy  studio  fur  sit  looking  terrier,dog  mammal  dog breed  vertebrate  maltese  morkie  dog like mammal  dog breed group  west highland white terrier  puppy  schnoodle  terrier  cairn terrier  bichon
1170027_614140175308821_2065590064_n,702714489,https://scontent.cdninstagram.com/hphotos-xap1/t51.2885-15/e15/1170027_614140175308821_2065590064_n.jpg,vintage  old  illustration  desktop  art  head  monochrome  retro  people  skull  frame  antique  one  anatomy  texture  face  abstract  print  human  portrait,black and white  image  nose  mouth  organ  head  monochrome photography  jaw  tooth  eye  medical imaging  arm  monochrome  hand  sense  emotion  human body  chest  ear
924204_251210268370007_559222191_n,702714490,https://scontent.cdninstagram.com/hphotos-xap1/t51.2885-15/e15/924204_251210268370007_559222191_n.jpg,people  group  nightclub  several  adult  wear  group together  music  many  dancing  man  performance  celebration  woman  singer  musician  religion  pants  facial expression  lid,people  performance  music  musical theatre  disco
10299606_1411673109103794_197031437_n,702714492,https://scontent.cdninstagram.com/hphotos-xap1/t51.2885-15/e15/10299606_1411673109103794_197031437_n.jpg,nude  bed  reclining  bedroom  facial expression  one  portrait  relaxation  indoors  adult  people  towel  shirtless  woman  man  blanket  intimacy  room  pillow  son,face  facial expression  cheek  person  nose  photography  male  man  close up  smile  mouth  skin  head  blond  muscle  organ  finger  hand  sense  emotion
10362093_287677201395757_612932460_n,702714493,https://scontent.cdninstagram.com/hphotos-xfa1/t51.2885-15/e15/10362093_287677201395757_612932460_n.jpg,desktop  disjunct  no person  graphic  text  illustration  business  abstract  design  symbol  isolated  science  art  conceptual  typographic  education  writing  decoration  horizontal  internet,text  font  product  line  brand  shape  diagram  document  presentation
1922412_251626638349994_8136089_n,702714495,https://scontent.cdninstagram.com/hphotos-xaf1/t51.2885-15/e15/1922412_251626638349994_8136089_n.jpg,woman  fashion  sexy  wear  pretty  people  adult  glamour  indoors  portrait  lingerie  model  young  thinning  girl  two  leisure  dancing  seduction  erotic,clothing  lady  thigh  black hair  leg  long hair  undergarment  finger  supermodel  photo shoot  tights  human body  model
927917_703330996385076_450225860_n,702714497,https://scontent.cdninstagram.com/hphotos-xpa1/t51.2885-15/e15/927917_703330996385076_450225860_n.jpg,illustration  art  rainbow  color  clip  line  disjunct  design  desktop  funny  equipment  visuals  isolated  sketch  motley  symbol  plastic  scribble  no person  image,cartoon  organ  finger  hand  tooth  human body  ear
1172160_342114185930935_586895237_n,702714498,https://scontent.cdninstagram.com/hphotos-xap1/t51.2885-15/e15/1172160_342114185930935_586895237_n.jpg,guitar  music  one  instrument  musician  people  adult  man  guitarist  portrait  young  player  performance  concert  desktop  studio  person  play  rock  sound,guitarist  guitar  slide guitar  plucked string instruments  bass guitar  musician  bassist  musical instrument  string instrument  string instrument  acoustic guitar
10431967_701685753226556_1346517625_n,702714500,https://scontent.cdninstagram.com/hphotos-xpa1/t51.2885-15/e15/10431967_701685753226556_1346517625_n.jpg,tree  one  no person  people  environment  outdoors  wood  two  daylight  travel  water  adult  bird  rainforest  nature  hurricane  landscape  leaf  weather  side view,bird  perching bird
1171034_1424847277732253_1867387577_n,702714505,https://scontent.cdninstagram.com/hphotos-xfa1/t51.2885-15/e15/1171034_1424847277732253_1867387577_n.jpg,World Wide Web  user  browser  page  form  internet  site  text  login  business  password  click  facts  label  data  register  navigation  information  computer  service,gadget  document  hand  technology  presentation
1689111_414324155368738_1637080500_n,702714506,https://scontent.cdninstagram.com/hphotos-xpa1/t51.2885-15/e15/1689111_414324155368738_1637080500_n.jpg,people  child  road  drag race  seated  vehicle  police  street  bike  action  competition  accident  adult  man  helmet  wheelchair  recreation  race (competition)  outdoors  offense,costume  vehicle
1538451_416822115118304_1111622395_n,702714507,https://scontent.cdninstagram.com/hphotos-xap1/t51.2885-15/e15/1538451_416822115118304_1111622395_n.jpg,cup  chocolate  coffee  sweet  sugar  food  drink  no person  breakfast  cookie  tea  milk  pastry  refreshment  dawn  delicious  cake  candy  table  baking,food  dish  cup  meal  breakfast  dessert  coffee cup  snack food  baking  flavor
1172662_354617631351185_1310432322_n,702714508,https://scontent.cdninstagram.com/hphotos-xap1/t51.2885-15/e15/1172662_354617631351185_1310432322_n.jpg,woman  portrait  girl  fashion  people  one  pretty  jewelry  adult  model  sexy  hair  young  beautiful  eye  glamour  face  jewelry band  cute  wear,eyebrow  hair  face  nose  person  photography  beauty  brown hair  supermodel  head  lip  hairstyle  long hair  singer  model  eye  black hair  photo shoot  hand  selfie
10413911_777097508982196_50956296_n,702714510,https://scontent.cdninstagram.com/hphotos-xpf1/t51.2885-15/e15/10413911_777097508982196_50956296_n.jpg,love  woman  people  portrait  fashion  Halloween  adult  man  fun  retro  girl  child  romance  young  togetherness  happiness  cute  bizarre  beautiful  two,hair  face  nose  blond  hairstyle  head  brown hair  mouth  long hair  organ  toy  eye  doll  lip  finger
1516334_239947422842811_1713475211_n,702714512,https://scontent.cdninstagram.com/hphotos-xaf1/t51.2885-15/e15/1516334_239947422842811_1713475211_n.jpg,portrait  woman  fashion  people  girl  model  face  hair  one  beautiful  adult  eye  glamour  cute  sexy  pretty  wear  veil  elegant  nature,hair  clothing  beauty  hairstyle  head  portrait  long hair  photo shoot  portrait photography  veil  model  sketch  drawing
10387760_874192385940992_1690643219_n,702714513,https://scontent.cdninstagram.com/hphotos-xpa1/t51.2885-15/e15/10387760_874192385940992_1690643219_n.jpg,animal  cute  little  dog  sit  puppy  mammal  canine  fur  funny  humor  friendship  curiosity  portrait  tiny  looking  pet  terrier  young  staring,dog  dog breed  mammal  chihuahua  dog like mammal  brand
924209_187848484749062_931196318_n,702714516,https://scontent.cdninstagram.com/hphotos-xpa1/t51.2885-15/e15/924209_187848484749062_931196318_n.jpg,woman  people  business  person  education  sign  desktop  isolated  presentation  adult  portrait  young  girl  beautiful  school  pretty  illustration  meditation  one  technology,human action  text  person  font  biology  learning  writing  brand  advertising  plan  presentation
916350_185868138286336_29105572_n,702714517,https://scontent.cdninstagram.com/hphotos-xaf1/t51.2885-15/e15/916350_185868138286336_29105572_n.jpg,text  cloud  typographic  conceptual  desktop  business  abstract  definition  company  education  tatter  achievement  management  vision  creativity  identify  knowledge  research  weight  squad,text  font  line  shape  brand
1516060_618393521576419_1231866399_n,702714519,https://scontent.cdninstagram.com/hphotos-xpa1/t51.2885-15/e15/1516060_618393521576419_1231866399_n.jpg,people  woman  school  group  music  performance  education  child  fun  festival  man  adult  indoors  singer  adolescent  concert  musician  university  young  youth,color  performance art  stage  musical theatre  art  fashion  spring
10011380_593315400765189_599622532_n,702714524,https://scontent.cdninstagram.com/hphotos-xpa1/t51.2885-15/e15/10011380_593315400765189_599622532_n.jpg,stock  fashion  displayed  sale  souvenir  option  shop  luxury  color  shopping  market  decoration  collection  jewelry  glass items  bazaar  wear  beads  accessory  many,art
1515809_235269726665794_551615928_n,702714525,https://scontent.cdninstagram.com/hphotos-xpf1/t51.2885-15/e15/1515809_235269726665794_551615928_n.jpg,woman  girl  portrait  fashion  young  model  beautiful  people  adult  wear  adolescent  smile  pretty  person  friendship  lifestyle  casual  bag  brunette  lady,clothing  blue  footwear  tights  jeans  pattern  leg  thigh  fashion  dress  design  denim  shoe  model  abdomen  photo shoot
914696_1487146338183627_1679435111_n,702714526,https://scontent.cdninstagram.com/hphotos-xfa1/t51.2885-15/e15/914696_1487146338183627_1679435111_n.jpg,food  bread  sandwich  no person  meat  french fries  tomato  lunch  vegetable  cheese  lettuce  meal  fast  delicious  bun  dinner  unhealthy  burger  chicken  bacon,food  dish  hamburger  meal  grilling  fast food  sandwich  produce  meat  veggie burger  lunch  cheeseburger  breakfast  french fries  junk food  cuisine
1739996_206611502872013_809118095_n,702714532,https://scontent.cdninstagram.com/hphotos-xpa1/t51.2885-15/e15/1739996_206611502872013_809118095_n.jpg,text  desktop  business  conceptual  abstract  education  typographic  illustration  company  science  cloud  medicine  graphic  tatter  research  facts  knowledge  internet  creativity  symbol,text  font  line  shape  brand  diagram  document  presentation
927564_373922389417518_1035471138_n,702714535,https://scontent.cdninstagram.com/hphotos-xap1/t51.2885-15/e15/927564_373922389417518_1035471138_n.jpg,business  paper  horizontal  finance  currency  wealth  money  desktop  no person  financial  vertical  achievement  investment  savings  text  symbol  sale  abundance  economy  number,skin  label  breakfast  food  flavor  cream  dessert
927814_606163999454303_1818468910_n,702714537,https://scontent.cdninstagram.com/hphotos-xpa1/t51.2885-15/e15/927814_606163999454303_1818468910_n.jpg,portrait  people  woman  one  adult  fashion  girl  lid  model  wear  hair  hairdo  winter  facial expression  glamour  veil  sexy  music  fashionable  cold,clothing  fur  head  hat  cap  fur clothing  fashion accessory  textile  portrait  headgear
1389054_769817526368939_1408739950_n,702714538,https://scontent.cdninstagram.com/hphotos-xap1/t51.2885-15/e15/1389054_769817526368939_1408739950_n.jpg,portrait  man  people  fashion  dark  model  face  adult  studio  one  fine-looking  young  guy  eye  indoors  smile  fun  beautiful  girl  brunette,color  hair  face  person  man  photography  facial hair  male  beauty  portrait  head  beard  model  photo shoot  singing  singer  portrait photography
1738180_454695894657001_809570516_n,702714539,https://scontent.cdninstagram.com/hphotos-xaf1/t51.2885-15/e15/1738180_454695894657001_809570516_n.jpg,people  art  portrait  painting  man  head  retro  illustration  religion  symbol  image  no person  decoration  adult  god  vintage  old  skull  one  human,black  black and white  monochrome  monochrome photography  art  sketch  drawing  illustration
1168682_448014848631385_2132844281_n,702714541,https://scontent.cdninstagram.com/hphotos-xpa1/t51.2885-15/e15/1168682_448014848631385_2132844281_n.jpg,wood  winter  snow  tree  nature  cold  empty  landscape  weather  no person  bench  season  desktop  art  wooden  park  frost  chair  storm  old,wall  floor  wood  outdoor structure
1742629_300323046790513_1506019645_n,702714542,https://scontent.cdninstagram.com/hphotos-xfp1/t51.2885-15/e15/1742629_300323046790513_1506019645_n.jpg,signal  competition  football  people  soccer  road  education  drag race  school  stadium  action  bill  goal  athlete  signalise  outdoors  battle  landscape  game  business,sport venue  stadium  advertising  sign  race
1168658_189280991261546_1910732921_n,702714544,https://scontent.cdninstagram.com/hphotos-xpa1/t51.2885-15/e15/1168658_189280991261546_1910732921_n.jpg,animal  cute  dog  illustration  vector  sketch  viral vector  humor  funny  puppy  cheerful  little  mammal  fun  pet  child  mascot  friendship  baby  happiness,cartoon  clip art  illustration
1538572_615972861784052_1315362739_n,702714550,https://scontent.cdninstagram.com/hphotos-xpa1/t51.2885-15/e15/1538572_615972861784052_1315362739_n.jpg,food  dinner  meal  lunch  tomato  vegetable  dish  delicious  cuisine  meat  healthy  plate  basil  beef  salad  epicure  no person  parsley  diet  tasty,food  dish  produce  cuisine  meal  salad  breakfast  vegetable  meat  vegetarian food  flowering plant
1170636_1409301972640190_2103914932_n,702714551,https://scontent.cdninstagram.com/hphotos-xap1/t51.2885-15/e15/1170636_1409301972640190_2103914932_n.jpg,people  education  group  election  school  adult  child  wear  competition  man  many  woman  candidate  politician  teacher  race (competition)  athlete  portrait  administration  facial expression,youth  community  education  learning  class
1530873_1408032819441224_1407390494_n,702714555,https://scontent.cdninstagram.com/hphotos-xap1/t51.2885-15/e15/1530873_1408032819441224_1407390494_n.jpg,fashion  wear  casual  leather  shopping  denim  pants  pocket  cotton  garment  shop  isolated  style  textile  strap  closeup  elegant  buckle  desktop  sale,handbag  footwear  zipper  fashion accessory  leather  textile  brand  hand  pattern  material
1963149_1477460302482190_535706323_n,702714562,https://scontent.cdninstagram.com/hphotos-xap1/t51.2885-15/e15/1963149_1477460302482190_535706323_n.jpg,graffiti  people  rap  one  adult  urban  street  music  hip  hop  man  cool  wall  woman  outdoors  musician  fashion  fashionable  color  portrait,color  blue  art  graffiti  fashion  spring  cool
916468_270012299847703_1610296576_n,702714567,https://scontent.cdninstagram.com/hphotos-xaf1/t51.2885-15/e15/916468_270012299847703_1610296576_n.jpg,cat  one  pet  kitten  no person  portrait  cute  people  mammal  indoors  fun  animal  motley  dog  rabbit  love  family  little  child  eye,cat  white  mammal  vertebrate  whiskers  nose  kitten  small to medium sized cats  cat like mammal  skin
1516410_190567247815434_8515709_n,702714569,https://scontent.cdninstagram.com/hphotos-xap1/t51.2885-15/e15/1516410_190567247815434_8515709_n.jpg,woman  girl  people  fashion  portrait  adult  beautiful  young  fun  two  friendship  happiness  wear  pretty  model  cute  brunette  party  lifestyle  love,brand  photo shoot
10413217_680103225377704_984412210_n,702714575,https://scontent.cdninstagram.com/hphotos-xfp1/t51.2885-15/e15/10413217_680103225377704_984412210_n.jpg,fashion  stock  business  wear  shirt  sale  wardrobe  cotton  no person  shopping  garment  apparel  boutique  desktop  shop  design  modern  jacket  isolated  sign,t shirt  clothing  black  sleeve  outerwear  product  font  sports uniform  sleeveless shirt  shirt  brand  sportswear
10251325_1439072526338100_808540000_n,702714579,https://scontent.cdninstagram.com/hphotos-xfp1/t51.2885-15/e15/10251325_1439072526338100_808540000_n.jpg,footwear  foot  two  woman  fashion  people  man  wear  no person  isolated  business  healthcare  health  conceptual  adult  one  indoors  couple together  shoe  sneakers,footwear  pink  shoe  spring  leg  human body
1662918_270883626410501_1283667271_n,702714583,https://scontent.cdninstagram.com/hphotos-xpa1/t51.2885-15/e15/1662918_270883626410501_1283667271_n.jpg,stripe  form  layout  no person  template  navigation  World Wide Web  page  label  site  user  menu (food)  restaurant check  interface  login  banner  sandbank  business  facts  set,text  font  web page  product  document  diagram  brand  line  screenshot  presentation
1388912_597814520257208_1708742253_n,702714585,https://scontent.cdninstagram.com/hphotos-xpa1/t51.2885-15/e15/1388912_597814520257208_1708742253_n.jpg,text  business  message  send message  sale  note  paper  texture  stock  label  card  display  sign  wear  desktop  notice  conceptual  design  shopping  dress,t shirt  white  clothing  sleeve  product  font  sleeveless shirt  outerwear  brand  baby & toddler clothing
1168689_540722249351999_1874898572_n,702714592,https://scontent.cdninstagram.com/hphotos-xap1/t51.2885-15/e15/1168689_540722249351999_1874898572_n.jpg,snake  desktop  nature  art  isolated  isolate  image  reptile  danger  human  color  head  animal  exotic  vintage  skin  hand  illustration  toxic  space,serpent  reptile  illustration
917887_556410617809719_476604205_n,702714595,https://scontent.cdninstagram.com/hphotos-xaf1/t51.2885-15/e15/917887_556410617809719_476604205_n.jpg,no person  desktop  illustration  business  elegant  conceptual  isolated  disjunct  design  decoration  one  abstract  people  style  text  science  graphic  vector  woman  paper,text  product  font  line  brand  shape  document
925710_207514309437748_19924822_n,702714597,https://scontent.cdninstagram.com/hphotos-xap1/t51.2885-15/e15/925710_207514309437748_19924822_n.jpg,people  adult  portrait  dog  lid  canine  man  one  two  mammal  facial expression  sit  wear  three  monochrome  veil  son  child  street  baby,black  black and white  photograph  person  man  photography  human positions  male  monochrome photography  monochrome  glasses  portrait
10175379_695525507187573_1401250713_n,702714599,https://scontent.cdninstagram.com/hphotos-xap1/t51.2885-15/e15/10175379_695525507187573_1401250713_n.jpg,competition  balance  exercise  action  skateboard  recreation  street  city  motion  track and field  skate  agility  people  dangerous  outdoors  fun  skill  sport  challenge  gymnastics,human action  sports  advertising  extreme sport  jumping
1390121_540093622744795_1551076338_n,702714604,https://scontent.cdninstagram.com/hphotos-xfp1/t51.2885-15/e15/1390121_540093622744795_1551076338_n.jpg,no person  food  vertical  box  celebration  fruit  party  color  container  drink  people  wood  fun  text  desktop  still life  vacation  business  festival  summer,food  dessert
916400_662653540443470_1054651516_n,702714607,https://scontent.cdninstagram.com/hphotos-xfa1/t51.2885-15/e15/916400_662653540443470_1054651516_n.jpg,portrait  woman  fashion  girl  model  street  pretty  people  graffiti  beautiful  young  urban  brunette  sexy  one  outdoors  cute  summer  casual  adolescent,facial expression  clothing  girl  lady  beauty  smile  fashion  model  glasses  photo shoot
914667_271418313040113_1314561512_n,702714608,https://scontent.cdninstagram.com/hphotos-xaf1/t51.2885-15/e15/914667_271418313040113_1314561512_n.jpg,people  adult  music  graffiti  portrait  woman  musician  festival  one  man  wear  competition  election  soccer  drag race  bill  child  performance  group  education,art  fashion
1971544_427776140658912_1241852252_n,702714612,https://scontent.cdninstagram.com/hphotos-xfp1/t51.2885-15/e15/1971544_427776140658912_1241852252_n.jpg,conceptual  no person  facts  World Wide Web  layout  graphic  company  business  procedure  graphic design  template  presentation  illustration  page  tag  abstract  internet  education  text  designing,text  product  font  line  diagram  document  brand  shape  presentation
1168705_564520896957412_1720064881_n,702714618,https://scontent.cdninstagram.com/hphotos-xap1/t51.2885-15/e15/1168705_564520896957412_1720064881_n.jpg,people  child  man  recreation  competition  adult  wheelchair  two  one  boy  woman  adolescent  wear  athlete  enjoyment  healthcare  wheel  road  action  outdoors,human positions  sitting  wheelchair  child
1517338_1394926177426261_2128171971_n,702714620,https://scontent.cdninstagram.com/hphotos-xpa1/t51.2885-15/e15/1517338_1394926177426261_2128171971_n.jpg,football  soccer  competition  man  stadium  match  people  athlete  ball  wear  game  adult  uniform  portrait  outfit  sports fan  goal  victory  sports equipment  action,player  football player  basketball moves  baseball positions
