fname,media_id,url,clarifai_labels,google_labels
1516293_196462497226455_1986406524_n,652903464,http://scontent-b.cdninstagram.com/hphotos-xfp1/t51.2885-15/1516293_196462497226455_1986406524_n.jpg,banner  competition  championship  football  template  World Wide Web  illustration  soccer  sport  presentation  vector  people  race  bill  man  information  navigation  squad  vectors  set,player  advertising  brand
1515729_429508260510068_693592688_n,652903466,http://scontent-b.cdninstagram.com/hphotos-xfp1/t51.2885-15/1515729_429508260510068_693592688_n.jpg,nature  sky  no person  outdoors  sunset  silhouette  travel  summer  sun  dusk  landscape  water  fair weather  dawn  illustration  cloud  desktop  dark  moon  bright,poster  advertising
929377_441890955912387_37965014_n,652903469,http://scontent-a.cdninstagram.com/hphotos-xap1/t51.2885-15/929377_441890955912387_37965014_n.jpg,woman  man  people  young  adult  fashion  portrait  couple  girl  bill  pretty  business  beautiful  bar  attractive  looking  indoors  smile  sit  restaurant,album cover  picture frame  brand  advertising
1597797_529392307158400_2070255553_n,652903471,http://scontent-a.cdninstagram.com/hphotos-xap1/t51.2885-15/1597797_529392307158400_2070255553_n.jpg,people  portrait  face  man  girl  adult  child  eye  one  freckle  lips  skin  woman  adolescent  facial expression  son  model  person  pain  mouth,face  color  eyebrow  nose  hair  cheek  facial expression  human action  forehead  person  red  chin  eye  close up  photography  lip  facial hair  beauty  mouth  skin
1516097_1377128242547118_164994120_n,652903472,http://scontent-b.cdninstagram.com/hphotos-xpf1/t51.2885-15/1516097_1377128242547118_164994120_n.jpg,people  adult  woman  business  portrait  monochrome  horizontal  communication  man  indoors  looking  side view  person  one  text  serious  content  success  actor  education,human action  brand  album cover  presentation
1169781_250559088401844_345279367_n,652903474,http://scontent-b.cdninstagram.com/hphotos-xfp1/t51.2885-15/1169781_250559088401844_345279367_n.jpg,group  collage  woman  portrait  four  face  set  friendship  collection  isolated  facial  girl  young  group together  many  fashion  hair  three  squad  model,face  clothing  nose  head  fashion accessory  organ  hair accessory  ear  vision care  eye  human body
1516934_503049906475446_279407898_n,652903475,http://scontent-a.cdninstagram.com/hphotos-xpf1/t51.2885-15/1516934_503049906475446_279407898_n.jpg,no person  abstract  pattern  dark  art  luxury  wallpaper  desktop  design  people  simplicity  background  monochrome  vertical  fabric  empty  old  full moon  insubstantial  template,text  black  font  product  logo  screenshot  brand  line  design  presentation
1516381_218249101695805_606472170_n,652903476,http://scontent-a.cdninstagram.com/hphotos-xfp1/t51.2885-15/1516381_218249101695805_606472170_n.jpg,people  man  woman  music  group  performance  musician  many  competition  adult  group together  singer  movie  sports fan  recreation  festival  band  concert  portrait  wear,
1516022_455147581280447_137198311_n,652903477,http://scontent-b.cdninstagram.com/hphotos-xpa1/t51.2885-15/1516022_455147581280447_137198311_n.jpg,vertical  no person  illustration  indoors  technology  business  outdoors  square  transportation system  horizontal  equipment  people  empty  glazed  vector  retro  dirty  danger  internet  modern,product  brand  window  presentation  glass
1517186_759381057424929_1312238766_n,652903478,http://scontent-b.cdninstagram.com/hphotos-xpa1/t51.2885-15/1517186_759381057424929_1312238766_n.jpg,championship  competition  sport  race  communication  athlete  track  squad  football  man  champion  cup  uniform  illustration  adult  signalise  hurry  auto racing  bike  helmet,player  advertising  brand  football equipment and supplies  football autographed paraphernalia  basketball moves
917516_493477770761472_1916499031_n,652903479,http://scontent-b.cdninstagram.com/hphotos-xfa1/t51.2885-15/917516_493477770761472_1916499031_n.jpg,illustration  text  education  desktop  page  business  vector  presentation  people  graphic  horizontal  template  World Wide Web  abstract  composition  diagram  company  cloud  vectors  banner,text  font  web page  line  brand  shape  presentation  diagram
1517210_234262126752857_1565962808_n,652903480,http://scontent-b.cdninstagram.com/hphotos-xpa1/t51.2885-15/1517210_234262126752857_1565962808_n.jpg,business  communication  screen  technology  blank  browser  text  display  internet  horizontal  pill  identity  desktop  World Wide Web  page  computer  monitor  template  cloud  picture frame,human action  text  font  product  document  brand  screenshot  learning  presentation
1530776_697589966941037_1844324070_n,652903481,http://scontent-b.cdninstagram.com/hphotos-xpa1/t51.2885-15/1530776_697589966941037_1844324070_n.jpg,monochrome  people  portrait  woman  business  paper  girl  isolated  adult  person  hand  black and white  desktop  model  sign  young  face  fashion  beautiful  retro,black and white  monochrome photography  hand  glasses  finger
1169195_453374038096063_1442160035_n,652903482,http://scontent-b.cdninstagram.com/hphotos-xpf1/t51.2885-15/1169195_453374038096063_1442160035_n.jpg,people  portrait  art  adult  illustration  man  one  retro  person  face  woman  desktop  painting  wear  child  business  baby  symbol  vintage  color,poster  cartoon  album cover  font  art  comics  illustration  advertising  drawing
915482_280037648814551_191589736_n,652903483,http://scontent-b.cdninstagram.com/hphotos-xfa1/t51.2885-15/915482_280037648814551_191589736_n.jpg,newspaper  man  people  paper  business  adult  horizontal  text  document  press  portrait  communication  indoors  correspondence  print  success  magazine  administration  writing  sit,human action  text  biology  writing  learning  brand  presentation  document
1515223_1434974610067642_1209618381_n,652903484,http://scontent-a.cdninstagram.com/hphotos-xpa1/t51.2885-15/1515223_1434974610067642_1209618381_n.jpg,flag  horizontal  patriotism  identity  symbol  illustration  banner  desktop  pattern  country  square  stripe  vertical  national  pride  design  textile  pridefulness  shape  freedom,color  text  red  yellow  orange  font  lip  modern art  brand  material
1169860_255621764603641_591056548_n,652903485,http://scontent-b.cdninstagram.com/hphotos-xaf1/t51.2885-15/1169860_255621764603641_591056548_n.jpg,portrait  people  facial expression  two  girl  woman  wear  togetherness  child  adult  happiness  friendship  love  brunette  son  fashion  fun  adolescent  youth  interaction,human action  glasses  photograph  person  image  vision care  nose  photography  smile  selfie  eyewear  portrait  interaction
1516631_483822258393238_570173286_n,652903487,http://scontent-b.cdninstagram.com/hphotos-xpf1/t51.2885-15/1516631_483822258393238_570173286_n.jpg,golf  golfer  putt  golf club  fairway  putter  tee  bunker  course  hole  club  ball  landscape  par  sports equipment  recreation  competition  swing  tournament  caddie,structure  sports  golf  sport venue  outdoor recreation  recreation  golf club  golf course
926315_207818292741504_264105375_n,652903488,http://scontent-b.cdninstagram.com/hphotos-xpa1/t51.2885-15/926315_207818292741504_264105375_n.jpg,people  woman  man  adult  religion  group  celebration  child  wear  crowd  recreation  many  festival  parade  dancing  fun  performance  music  sports fan  veil,musical theatre
1515270_265936636899118_992542820_n,652903492,http://scontent-b.cdninstagram.com/hphotos-xfp1/t51.2885-15/1515270_265936636899118_992542820_n.jpg,people  man  portrait  adult  one  tattoo  art  painting  religion  human  face  leader  person  symbol  illustration  head  god  fear  strong  spirituality,face  tattoo  arm  head  tattoo artist  muscle  human body  chest
1527746_980004008708196_255089155_n,652903496,http://scontent-b.cdninstagram.com/hphotos-xpf1/t51.2885-15/1527746_980004008708196_255089155_n.jpg,food  nature  fruit  no person  desktop  tropical  exotic  vegetable  health  nutrition  text  image  freshness  healthy  diet  flora  bright  summer  vertical  horizontal,yellow  food  produce  land plant  flowering plant
1208285_285888641562846_683236650_n,652903497,http://scontent-b.cdninstagram.com/hphotos-xpa1/t51.2885-15/1208285_285888641562846_683236650_n.jpg,desktop  graphic  education  conceptual  school  business  retro  no person  illustration  text  chalk  abstract  science  wallpaper  research  knowledge  internet  medicine  design  vintage,text  human action  font  biology  brand  emotion  line  presentation
1742524_357113034431656_290476572_n,652903498,http://scontent-a.cdninstagram.com/hphotos-xfa1/t51.2885-15/1742524_357113034431656_290476572_n.jpg,text  definition  education  book  dictionary  desktop  knowledge  school  typescript  conceptual  business  disease  page  management  wisdom  abstract  medicine  science  handbook  research,text  font  line  handwriting  shape  document
1662663_197517530447132_804013328_n,652903500,http://scontent-b.cdninstagram.com/hphotos-xpf1/t51.2885-15/1662663_197517530447132_804013328_n.jpg,tattoo  people  human  person  body  art  man  design  pattern  symbol  part  old  vintage  culture  painting  shape  artistic  color  style  big,tattoo  arm  tattoo artist  human body  chest
1740780_464061947050551_1996482728_n,652903501,http://scontent-a.cdninstagram.com/hphotos-xaf1/t51.2885-15/1740780_464061947050551_1996482728_n.jpg,city  cityscape  urban  skyline  evening  architecture  dusk  downtown  skyscraper  light  building  street  bridge  travel  sky  sunset  modern  river  sight  tower,skyline  cityscape  city  night  human settlement  metropolis  evening  metropolitan area  skyscraper  panorama  dusk
1661257_604046093003829_1015150885_n,652903503,http://scontent-a.cdninstagram.com/hphotos-xpf1/t51.2885-15/1661257_604046093003829_1015150885_n.jpg,footwear  fashion  shoe  wear  foot  couple together  no person  sneakers  shining  two  trendy  bright  elegant  color  leather  design  casual  classic  contemporary  winter,footwear  shoe  sneakers  blue  purple  electric blue  cobalt blue  violet  magenta  pattern
927214_591680744257506_481623248_n,652903504,http://scontent-a.cdninstagram.com/hphotos-xpa1/t51.2885-15/927214_591680744257506_481623248_n.jpg,military  man  war  people  wear  group together  adult  portrait  group  soldier  army  gun  outfit  uniform  four  weapon  recreation  five  woman  three,
1739320_809544209062602_1329586148_n,652903505,http://scontent-a.cdninstagram.com/hphotos-xfa1/t51.2885-15/1739320_809544209062602_1329586148_n.jpg,competition  boxer  people  group together  many  adult  athlete  gloves  two  sports equipment  strength  aggression  wear  martial arts  victory  man  bout  three  interaction  action,wrestling  sports  professional wrestling  shoot boxing  combat sport  contact sport  professional boxing  wrestler  puroresu  muay thai  individual sports
1169955_1375482746052063_1647468046_n,652903507,http://scontent-a.cdninstagram.com/hphotos-xap1/t51.2885-15/1169955_1375482746052063_1647468046_n.jpg,people  outdoors  adult  woman  winter  man  scarf  portrait  force  fear  horizontal  horror  fall  vertical  battle  coat  hood  danger  aggression  child,screenshot
1660724_274606399363293_486604578_n,652903508,http://scontent-b.cdninstagram.com/hphotos-xpa1/t51.2885-15/1660724_274606399363293_486604578_n.jpg,spider  insect  horizontal  wildlife  arachnid  invertebrate  outdoors  nature  illustration  phobia  skittish  tarantula  animal  zoology  fear  biology  danger  magnification  no person  horror,invertebrate  biology  organism  insect
1597485_1383119675286097_961721833_n,652903510,http://scontent-b.cdninstagram.com/hphotos-xap1/t51.2885-15/1597485_1383119675286097_961721833_n.jpg,people  portrait  adult  one  man  administration  leader  mustache  wear  facial hair  music  group  veil  two  lid  offense  three  art  musician  outfit,black and white  person  image  monochrome photography  monochrome  facial hair
1799831_656868084377740_241128228_n,652903511,http://scontent-a.cdninstagram.com/hphotos-xpa1/t51.2885-15/1799831_656868084377740_241128228_n.jpg,no person  desktop  fashion  color  elegant  woman  bright  clean  one  disjunct  artistic  isolated  abstract  texture  design  nature  health  art  fabric  pattern,bird  fashion accessory  wing  textile  material
927298_1505575556321485_1342108409_n,652903513,http://scontent-b.cdninstagram.com/hphotos-xpa1/t51.2885-15/927298_1505575556321485_1342108409_n.jpg,beach  water  bikini  sexy  sea  sand  summer  ocean  leisure  vacation  woman  travel  wet  swimsuit  bronzing  sun  recreation  seashore  fun  health,clothing  swimwear  beauty  girl  sea  muscle  vacation  leg  photo shoot  sun tanning  model  beach  human body  maillot  abdomen
1736848_411080539023262_1002888952_n,652903515,http://scontent-b.cdninstagram.com/hphotos-xfa1/t51.2885-15/1736848_411080539023262_1002888952_n.jpg,text  template  business  presentation  World Wide Web  page  illustration  desktop  abstract  company  facts  internet  card  conceptual  banner  graphic  education  layout  procedure  vector,text  line  font  web page  shape  brand  diagram  presentation  document
1742661_354413388031364_82946445_n,652903516,http://scontent-b.cdninstagram.com/hphotos-xap1/t51.2885-15/1742661_354413388031364_82946445_n.jpg,woman  people  friendship  fashion  portrait  adult  music  wear  glamour  facial expression  group  togetherness  love  brunette  actress  adolescent  dark  sexy  indoors  three,photography  brown hair  supermodel  glasses  photo shoot
1889189_733288196688882_579910635_n,652903518,http://scontent-b.cdninstagram.com/hphotos-xpf1/t51.2885-15/1889189_733288196688882_579910635_n.jpg,dirty  horizontal  parchment  canvas  paper  antique  square  messy  mottled  abstract  ancient  empty  retro  vertical  wear  soil  pattern  simplicity  old  rough,text  font  morning  brand  shape  emotion  writing  presentation
924269_216856068502964_840493121_n,652903519,http://scontent-a.cdninstagram.com/hphotos-xpa1/t51.2885-15/924269_216856068502964_840493121_n.jpg,template  navigation  World Wide Web  stripe  layout  menu (food)  site  page  form  graph  arrow  banner  restaurant check  label  set  sandbank  login  skidder  vectors  browse,web page  product  font  diagram  line  brand  document  screenshot  presentation
1741049_466898896769580_292817235_n,652903520,http://scontent-a.cdninstagram.com/hphotos-xfp1/t51.2885-15/1741049_466898896769580_292817235_n.jpg,illustration  vector  symbol  retro  design  art  desktop  image  sign  graphic  bill  disjunct  head  silhouette  decoration  skull  Halloween  horror  visuals  tattoo,poster  cartoon  font  brand  album cover  illustration  advertising
1738572_272190972930671_627796064_n,652903521,http://scontent-b.cdninstagram.com/hphotos-xaf1/t51.2885-15/1738572_272190972930671_627796064_n.jpg,flag  patriotism  unity  pride  wind  stripe  banner  united  freedom  no person  honor  identity  country  administration  election  unify  symbol  quarter  independence day  travel,flag  flag of the united states  brand  automotive exterior  banner  advertising
1738937_662351813803508_2141708601_n,652903522,http://scontent-b.cdninstagram.com/hphotos-xfp1/t51.2885-15/1738937_662351813803508_2141708601_n.jpg,girl  nature  park  woman  grass  maternity  outdoors  beautiful  happiness  fall  one  lifestyle  wood  fun  portrait  leisure  young  outside  model  summer,clothing  dress  footwear  tights  thigh  photo shoot  pattern  abdomen
1799783_593345040750437_48891487_n,652903524,http://scontent-a.cdninstagram.com/hphotos-xpf1/t51.2885-15/1799783_593345040750437_48891487_n.jpg,illustration  print  art  lithograph  vintage  vertical  people  painting  adult  old  antique  retro  woman  paper  horizontal  text  postcard  bird  letter  ancient,cartoon  comics  illustration
1662778_242412515941512_219425347_n,652903526,http://scontent-b.cdninstagram.com/hphotos-xpa1/t51.2885-15/1662778_242412515941512_219425347_n.jpg,vehicle  car  transportation system  race  auto racing  competition  championship  fast  no person  track  engine  power  drive  exhibition  action  industry  automotive  safety  driver  hurry,car  vehicle  automotive exterior  bumper  automobile make  open wheel car  race car  supercar
1799605_568181639964606_1559005530_n,652903530,http://scontent-b.cdninstagram.com/hphotos-xfp1/t51.2885-15/1799605_568181639964606_1559005530_n.jpg,nature  sunset  desktop  water  landscape  summer  sky  sea  sun  illustration  no person  outdoors  relaxation  dawn  dusk  beach  beautiful  symbol  silhouette  reflection,human action  text  brand  presentation
1741858_560278910734942_1256928184_n,652903533,http://scontent-b.cdninstagram.com/hphotos-xap1/t51.2885-15/1741858_560278910734942_1256928184_n.jpg,woman  pretty  isolated  young  health  fashion  friendly  looking  cute  one  elegant  casual  healthcare  adult  relaxation  contemporary  beautiful  people  attractive  portrait,clothing  photography  sleeve  dress  gown  photo shoot  blouse  outerwear  textile
1738991_1420509894858026_835664129_n,652903535,http://scontent-a.cdninstagram.com/hphotos-xpa1/t51.2885-15/1738991_1420509894858026_835664129_n.jpg,fashion  woman  portrait  model  people  girl  dress  glamour  one  pretty  wear  elegant  indoors  beautiful  wedding  sexy  hair  adult  young  gown,hair  human hair color  hairstyle  blond  long hair  hair coloring  ringlet  chignon  bun
917515_449018091894067_1586721656_n,652903538,http://scontent-a.cdninstagram.com/hphotos-xaf1/t51.2885-15/917515_449018091894067_1586721656_n.jpg,people  portrait  monochrome  two  love  woman  adult  man  girl  affection  couple  family  embrace  interaction  romance  profile  black and white  music  facial expression  kiss,human action  black and white  image  person  monochrome photography  romance  interaction  monochrome  photo shoot
1599978_1377569672513215_1225055741_n,652903540,http://scontent-a.cdninstagram.com/hphotos-xap1/t51.2885-15/1599978_1377569672513215_1225055741_n.jpg,wood  bird  nature  house  man  people  color  leisure  water  action  landscape  family  appoint  outdoors  no person  tree  war  abstract  desktop  design,wall  floor  flooring  roof  net  wood  outdoor structure  material
1725197_586567541434358_1357638686_n,652903541,http://scontent-b.cdninstagram.com/hphotos-xpa1/t51.2885-15/1725197_586567541434358_1357638686_n.jpg,tattoo  people  adult  man  portrait  art  one  painting  human  artistic  shirtless  abdomen  body  person  nude  athlete  religion  sexy  woman  model,tattoo  arm  tattoo artist  human body  chest  trunk
1941270_1466155640263643_633559119_n,652903542,http://scontent-b.cdninstagram.com/hphotos-xaf1/t51.2885-15/1941270_1466155640263643_633559119_n.jpg,illustration  vector  text  desktop  symbol  business  squad  disjunct  vectors  sign  image  banner  bill  graphic  isolated  people  designing  design  print  populace,text  cartoon  font  brand  label  advertising  presentation
1742482_419009851535903_1544495904_n,652903544,http://scontent-a.cdninstagram.com/hphotos-xfa1/t51.2885-15/1742482_419009851535903_1544495904_n.jpg,navigation  form  template  World Wide Web  page  label  layout  vectors  banner  menu (food)  stripe  illustration  site  restaurant check  facts  graph  business  diagram  vector  arrow,text  web page  font  product  line  diagram  document  brand  shape  presentation
1741936_294384467377490_507501808_n,652903546,http://scontent-a.cdninstagram.com/hphotos-xfa1/t51.2885-15/1741936_294384467377490_507501808_n.jpg,competition  football  athlete  man  stadium  uniform  people  action  adult  football player  wear  outfit  university  ball  motion  many  game  football stadium  touchdown  rugby,gridiron football  football player  player  american football  tackle  sports  soccer  touchdown
1688793_389797867830040_843770931_n,652903547,http://scontent-b.cdninstagram.com/hphotos-xap1/t51.2885-15/1688793_389797867830040_843770931_n.jpg,text  business  desktop  typographic  alphabet  symbol  conceptual  letter  management  abstract  facts  type  education  illustration  graphic  internet  technology  finance  solution  rudiment,line  font  shape  line art
1738761_286276898186979_39533491_n,652903549,http://scontent-a.cdninstagram.com/hphotos-xap1/t51.2885-15/1738761_286276898186979_39533491_n.jpg,illustration  isolated  man  vector  sketch  symbol  chalk out  human  person  desktop  art  blood  design  people  character  funny  woman  adult  cheerful  graphic,cartoon  font  brand  line  drawing  illustration  sketch
1689403_465310186927882_218734848_n,652903550,http://scontent-a.cdninstagram.com/hphotos-xfp1/t51.2885-15/1689403_465310186927882_218734848_n.jpg,football  stadium  uniform  competition  outfit  ball  athlete  football player  action  game  people  man  adult  wear  rugby  university  soccer  group together  many  soccer field,gridiron football  player  football player  american football  tackle  basketball moves  soccer  sports  touchdown  rugby league  stadium  sprint
1941242_222130447988784_1484127023_n,652903553,http://scontent-a.cdninstagram.com/hphotos-xpa1/t51.2885-15/1941242_222130447988784_1484127023_n.jpg,people  man  two  portrait  adult  bald  competition  elderly  love  woman  wear  leader  three  old  group  one  trophy  recreation  champion  religion,muscle
1737638_736830146336393_545959579_n,652903555,http://scontent-b.cdninstagram.com/hphotos-xfp1/t51.2885-15/1737638_736830146336393_545959579_n.jpg,woman  fashion  pretty  one  young  sexy  glamour  adult  elegant  people  dress  girl  portrait  model  wear  cute  business  looking  bill  contemporary,clothing  dress  footwear  fashion  spring  cocktail dress  pattern  outerwear  photo shoot  fashion design
1690453_242757102564093_1671841496_n,652903556,http://scontent-b.cdninstagram.com/hphotos-xap1/t51.2885-15/1690453_242757102564093_1671841496_n.jpg,locomotive  people  athlete  indoors  model  fashion  sport  girl  exercise  adult  competition  sexy  woman  dancer  subway system  portrait  muscle  one  motion  energy,clothing  performance art  muscle  sports  leg  dance
924905_500454153399041_843341022_n,652903557,http://scontent-a.cdninstagram.com/hphotos-xpa1/t51.2885-15/924905_500454153399041_843341022_n.jpg,people  two  facial expression  man  portrait  adult  wear  three  religion  group  offense  veil  goatee  woman  musician  music  lid  recreation  indoors  singer,person
1739272_514061352045639_554450304_n,652903558,http://scontent-a.cdninstagram.com/hphotos-xfa1/t51.2885-15/1739272_514061352045639_554450304_n.jpg,illustration  man  vector  people  sport  uniform  isolated  football  image  sketch  squad  protection  adult  athlete  cutout  wear  vectors  jersey  sale  safety,clothing  jersey  football player  font  gridiron football  american football  sports uniform  player  product  sportswear  sleeve  ball  brand  football equipment and supplies  sports fan jersey  t shirt  illustration
1971464_1387260791498862_527867759_n,652903559,http://scontent-a.cdninstagram.com/hphotos-xpa1/t51.2885-15/1971464_1387260791498862_527867759_n.jpg,competition  soccer  football  stadium  people  portrait  game  championship  adult  champion  match  athlete  man  race (competition)  sports fan  sport  audience  woman  ball  group,speech  advertising
926647_240672476113113_1005899409_n,652903561,http://scontent-b.cdninstagram.com/hphotos-xpa1/t51.2885-15/926647_240672476113113_1005899409_n.jpg,people  adult  man  woman  tree  portrait  illustration  desktop  horizontal  fashion  flower  modern  happiness  business  indoors  sit  young  cheerful  nature  card,pink  gown  magenta  t shirt  brand  pattern  design  textile
917336_1469365303276299_324269228_n,652903562,http://scontent-b.cdninstagram.com/hphotos-xfa1/t51.2885-15/917336_1469365303276299_324269228_n.jpg,people  portrait  adult  two  man  facial expression  musician  music  singer  woman  actress  wear  actor  group  pop music  movie  theater  guitarist  one  three,person  singer
1963092_1471085149779278_1445672666_n,652903563,http://scontent-b.cdninstagram.com/hphotos-xaf1/t51.2885-15/1963092_1471085149779278_1445672666_n.jpg,woman  text  people  bill  man  illustration  desktop  vertical  business  movie  conceptual  silhouette  theater  nature  adult  dark  indoors  family  love  no person,text  person  biology  brand  learning  presentation
1737880_1411643725758069_1446261865_n,652903566,http://scontent-a.cdninstagram.com/hphotos-xaf1/t51.2885-15/1737880_1411643725758069_1446261865_n.jpg,man  portrait  people  adult  one  facial expression  wear  fine-looking  serious  fashion  masculinity  hair  face  strength  eye  pensive  model  confidence  facial hair  studio,hair  face  facial expression  nose  person  man  chin  facial hair  male  hairstyle  head  skin  mouth  beard  portrait  sense  hand  moustache
10005197_223442594530863_1727166855_n,652910725,http://scontent-b.cdninstagram.com/hphotos-xfp1/t51.2885-15/10005197_223442594530863_1727166855_n.jpg,leader  people  group  politician  meeting  administration  man  league  election  woman  Congress  parliament  adult  democracy  group together  candidate  competition  festival  education  business,person
1740021_233068016887527_886287076_n,652910726,http://scontent-b.cdninstagram.com/hphotos-xfp1/t51.2885-15/1740021_233068016887527_886287076_n.jpg,offense  no person  one  military  text  security  war  road  industry  vehicle  sign  retro  people  old  business  desktop  accident  signalise  safety  force,automotive exterior  bumper  tire  technology
