fname,media_id,url,clarifai_labels,google_labels
1172935_254252704729924_2106147225_n,679604343,http://scontent-b.cdninstagram.com/hphotos-xpf1/t51.2885-15/e15/1172935_254252704729924_2106147225_n.jpg,football  competition  helmet  adult  man  people  athlete  protection  stadium  motion  football player  uniform  touchdown  action  quarterback  wear  skill  football stadium  university  veil,gridiron football  player  football player  baseball positions  american football  sports  tackle  soccer  football equipment and supplies
10358248_366454920153339_1904969355_n,679604412,http://scontent-b.cdninstagram.com/hphotos-xfa1/t51.2885-15/e15/10358248_366454920153339_1904969355_n.jpg,no person  internet  symbol  technology  isolated  dark  equipment  electricity  signalise  image  flat  simplicity  full moon  electronics  computer  danger  power  control  safety  illustration,text  logo  font  computer wallpaper  brand  screenshot  circle  line
1723356_1415493278697266_612303142_n,679604431,http://scontent-a.cdninstagram.com/hphotos-xap1/t51.2885-15/e15/1723356_1415493278697266_612303142_n.jpg,music  people  musician  performance  instrument  concert  one  adult  percussion instrument  drum  singer  drummer  band  guitar  stringed instrument  two  pop music  guitarist  microphone  stage,black and white  musician  guitarist  music  bassist  monochrome photography  stage  album cover  drums  monochrome  drummer  pianist  electronic instrument
1724920_221414021380788_1073291844_n,679604437,http://scontent-a.cdninstagram.com/hphotos-xfa1/t51.2885-15/e15/1724920_221414021380788_1073291844_n.jpg,people  man  recreation  sport  one  education  lid  person  adult  web  movie  business  school  athlete  illustration  ball  science  graphic  wear  chalk out,green  poster
10401633_1423443597919281_1481766529_n,679604473,http://scontent-b.cdninstagram.com/hphotos-xap1/t51.2885-15/e15/10401633_1423443597919281_1481766529_n.jpg,man  people  portrait  indoors  adult  woman  serious  fashion  wear  horizontal  one  looking  adolescent  intelligence  staring  business  individuality  determination  dark  strength,hair  man  hairstyle  facial hair
1516664_1385208401701667_749759339_n,679604482,http://scontent-a.cdninstagram.com/hphotos-xap1/t51.2885-15/e15/1516664_1385208401701667_749759339_n.jpg,competition  athlete  outfit  stadium  basketball  ball  uniform  people  wear  adult  game  sports equipment  group together  action  man  football  soccer  web  championship  match,basketball moves  basketball player  player  football player  team sport  sports  basketball  gridiron football  slam dunk  tournament  american football  competition event
1170359_213559365492371_685563935_n,679604517,http://scontent-b.cdninstagram.com/hphotos-xpa1/t51.2885-15/e15/1170359_213559365492371_685563935_n.jpg,man  portrait  people  music  adult  indoors  beard  fashion  eye  casual  model  face  guy  woman  fine-looking  boy  hair  young  smile  one,hair  face  facial expression  person  nose  man  facial hair  smile  skin  head  hairstyle  glasses  eye  beard
10251483_676022505819496_1340207400_n,679604522,http://scontent-b.cdninstagram.com/hphotos-xap1/t51.2885-15/e15/10251483_676022505819496_1340207400_n.jpg,competition  man  athlete  adult  people  sport  helmet  trophy  championship  football  headwear  vertical  game  ball  stadium  squad  influencer  cup  champion  award,player  baseball positions  football player  sports  ball game  ice hockey position
1742613_597151270373827_413250150_n,679604547,http://scontent-b.cdninstagram.com/hphotos-xfa1/t51.2885-15/e15/1742613_597151270373827_413250150_n.jpg,competition  people  athlete  man  adult  woman  recreation  group together  music  festival  group  championship  many  crowd  performance  sports fan  wear  boxer  fitness  enjoyment,muscle  sports  wrestler  physical fitness  bodybuilding  weight training  muay thai  powerlifting
1530901_473746522737071_1428363563_n,679604559,http://scontent-b.cdninstagram.com/hphotos-xpa1/t51.2885-15/e15/1530901_473746522737071_1428363563_n.jpg,competition  stadium  athlete  championship  people  football  audience  sports fan  game  crowd  sport  basketball  victory  soccer  group together  grandstand  sports equipment  ball  champion  uniform,sports  sport venue  basketball moves  stadium
928438_797324620293171_519890779_n,679604593,http://scontent-b.cdninstagram.com/hphotos-xpa1/t51.2885-15/e15/928438_797324620293171_519890779_n.jpg,people  business  commerce  finance  screen  landscape  computer  technology  travel  money  monitor  presentation  signalise  display  text  tourism  adult  internet  World Wide Web  performance,advertising  display device  signage  stage  presentation  flat panel display  electronic signage
10349609_1493151417565814_1430987634_n,679604614,http://scontent-a.cdninstagram.com/hphotos-xpa1/t51.2885-15/e15/10349609_1493151417565814_1430987634_n.jpg,uniform  people  wear  competition  fun  man  child  baseball  outfit  sports fan  audience  enjoyment  recreation  athlete  celebration  boy  football  protection  crowd  little,comics  screenshot
928440_608949389172658_22397143_n,679604681,http://scontent-b.cdninstagram.com/hphotos-xap1/t51.2885-15/e15/928440_608949389172658_22397143_n.jpg,helmet  competition  uniform  people  man  stadium  football  athlete  squad  game  protection  sport  action  ball  championship  defence  action energy  field  outfit  touchdown,college ice hockey  baseball player  ice hockey position  player  baseball positions  gridiron football  american football  sports  football equipment and supplies
1168633_341409015996245_261642503_n,679604725,http://scontent-a.cdninstagram.com/hphotos-xap1/l/t51.2885-15/e15/1168633_341409015996245_261642503_n.jpg,competition  stadium  football  championship  action energy  athlete  man  people  helmet  sport  game  uniform  squad  quarterback  ball  track  sports fan  touchdown  race  goal,player  baseball positions  basketball moves  sports  gridiron football  sport venue  american football  stadium  touchdown
1389579_214509792062511_1753619105_n,679604743,http://scontent-a.cdninstagram.com/hphotos-xap1/t51.2885-15/e15/1389579_214509792062511_1753619105_n.jpg,football  competition  athlete  stadium  performance  band  veil  rugby  outfit  university  people  recreation  soccer  award  sports fan  uniform  adult  wear  track  school,player  team  cycling  bicycle racing  racing  sports  official
10175127_835337363149478_859021303_n,679604764,http://scontent-b.cdninstagram.com/hphotos-xaf1/t51.2885-15/e15/10175127_835337363149478_859021303_n.jpg,people  portrait  fashion  dark  sunglasses  young  outdoors  man  one  nature  model  eyeglasses  face  summer  fun  eye  cute  adult  retro  woman,color  blue  beauty  glasses  smile  cool  hairstyle  vision care  fashion  sunglasses
1598944_578017608959938_390168156_n,679604781,http://scontent-b.cdninstagram.com/hphotos-xfa1/t51.2885-15/e15/1598944_578017608959938_390168156_n.jpg,people  adult  man  painting  art  one  facial expression  wear  woman  artistic  costume  competition  fun  portrait  illustration  festival  religion  nude  vintage  ancient,muscle
1169923_570550483034565_101830954_n,679604788,http://scontent-b.cdninstagram.com/hphotos-xfa1/t51.2885-15/e15/1169923_570550483034565_101830954_n.jpg,people  man  woman  group  adult  portrait  seat  family  two  facial expression  child  three  laughing  happiness  fun  couple  boy  girl  adolescent  movie,facial expression  human action  face  person  people  nose  photography  smile  head  mouth  organ  selfie  emotion  laughter  eye  human body  interaction
1389368_171703779702148_1397322068_n,679604814,http://scontent-b.cdninstagram.com/hphotos-xpa1/t51.2885-15/e15/1389368_171703779702148_1397322068_n.jpg,chair  table  furniture  seat  indoors  interior design  tableware  room  luxury  candle  candlestick  decoration  cutlery  place setting  no person  home  chandelier  inside  hotel  religion,room  restaurant  lighting  furniture  table  interior design  meal
1390065_1430006787220957_989711862_n,679604829,http://scontent-a.cdninstagram.com/hphotos-xfa1/t51.2885-15/e15/1390065_1430006787220957_989711862_n.jpg,people  one  wear  man  adult  portrait  facial expression  veil  cap  indoors  lid  woman  baseball cap  adolescent  child  boy  knitwear  sweater  outfit  outerwear,person  image  facial hair  selfie
10375620_616873278402165_551963924_n,679604842,http://scontent-b.cdninstagram.com/hphotos-xap1/t51.2885-15/e15/10375620_616873278402165_551963924_n.jpg,man  business  people  indoors  appoint  fine-looking  success  looking  paper  contemporary  suit  casual  achievement  fashion  wall  formal  actor  one  opportunity  portrait,clothing  footwear  arm  muscle  t shirt  brand  outerwear
10261319_853152694699041_1142793470_n,679604899,http://scontent-b.cdninstagram.com/hphotos-xpf1/t51.2885-15/e15/10261319_853152694699041_1142793470_n.jpg,restaurant  coffee  man  people  adult  two  indoors  employee  woman  table  business  bar  drink  group  stock  service  furniture  wear  commerce  food,restaurant
1173202_558254804244402_520718396_n,679604910,http://scontent-a.cdninstagram.com/hphotos-xpf1/t51.2885-15/e15/1173202_558254804244402_520718396_n.jpg,adult  people  business  woman  horizontal  indoors  portrait  communication  cheerful  happiness  headshot  vertical  confidence  office  technology  content  mental image  success  contemplation  sitting,brand  neck  t shirt  presentation
10362096_1504933896393161_620858173_n,679604940,http://scontent-a.cdninstagram.com/hphotos-xap1/t51.2885-15/e15/10362096_1504933896393161_620858173_n.jpg,woman  fashion  sexy  lingerie  glamour  model  girl  beautiful  young  underwear  adult  attractive  pretty  body  erotic  lady  style  person  pantie  people,clothing  undergarment  lingerie
10296939_642813035811572_676498903_n,679604965,http://scontent-a.cdninstagram.com/hphotos-xfp1/t51.2885-15/e15/10296939_642813035811572_676498903_n.jpg,desktop  decoration  nature  summer  illustration  retro  no person  design  celebration  health  vintage  symbol  isolate  old  food  picture frame  art  dark  text  abstract,biology  organ  petal  flower  human body
1538474_211754959015678_1671694738_n,679604979,http://scontent-b.cdninstagram.com/hphotos-xpa1/t51.2885-15/e15/1538474_211754959015678_1671694738_n.jpg,car  vehicle  automotive  drive  transportation system  coupe  wheel  sedan  convertible  hood  fast  hurry  driver  speed  engine  asphalt  headlight  roadster  public show  hatchback,car  vehicle  land vehicle  mid size car  sedan  cadillac  automobile make  executive car  cadillac cts  cadillac xts  automotive exterior  luxury vehicle
1530803_1431226893775219_310448511_n,679605031,http://scontent-a.cdninstagram.com/hphotos-xpa1/t51.2885-15/e15/1530803_1431226893775219_310448511_n.jpg,helmet  man  mask  football  competition  uniform  athlete  protection  face disguise  people  sport  soccer  stadium  action  wear  influencer  armor  sports fan  squad  festival,player  football player  ice hockey position  gridiron football  hockey protective equipment  baseball positions  football equipment and supplies  protective equipment in gridiron football  american football  basketball moves  ball  goaltender mask  tackle  football helmet  goalkeeper  soccer
1388805_596750810361368_755717937_n,679605092,http://scontent-a.cdninstagram.com/hphotos-xap1/t51.2885-15/e15/1388805_596750810361368_755717937_n.jpg,lid  man  portrait  people  retro  paper  adult  cap  illustration  isolated  person  head  communication  vintage  face  bill  uniform  woman  helmet  serious,clothing  cartoon  album cover  cap  brand
915504_1378825425718338_153951659_n,679605114,http://scontent-b.cdninstagram.com/hphotos-xaf1/t51.2885-15/e15/915504_1378825425718338_153951659_n.jpg,young  beautiful  adult  person  people  attractive  portrait  woman  desktop  one  smile  modern  fashion  lifestyle  face  looking  girl  pretty  man  model,t shirt  clothing  sleeve  brand  illustration  album cover  cool  neck
1527735_755722507790406_992696607_n,679605116,http://scontent-b.cdninstagram.com/hphotos-xfp1/t51.2885-15/e15/1527735_755722507790406_992696607_n.jpg,competition  helmet  athlete  football  people  uniform  action  stadium  wear  veil  football player  man  outfit  many  group together  championship  protection  university  football stadium  game,sports  ball game  baseball positions  ice hockey position  football equipment and supplies  gridiron football  american football  catcher
1516187_580120925396133_1790486555_n,679605125,http://scontent-a.cdninstagram.com/hphotos-xpa1/t51.2885-15/e15/1516187_580120925396133_1790486555_n.jpg,travel  city  transportation system  architecture  tourism  street  no person  building  road  outdoors  car  tourist  urban  business  traffic  modern  vacation  hotel  stock  town,road  street  town  urban area  cityscape  city  neighbourhood  metropolis  human settlement  residential area  downtown  infrastructure
918246_884632554896009_1820029290_n,679605172,http://scontent-a.cdninstagram.com/hphotos-xaf1/t51.2885-15/e15/918246_884632554896009_1820029290_n.jpg,competition  athlete  stadium  man  football  basketball  ball  game  uniform  soccer  people  web  adult  match  sport  outfit  action energy  action  group together  player,basketball moves  basketball player  football player  player  sports  wrestler  basketball  action figure  slam dunk
914703_878545345505746_1374299063_n,679605176,http://scontent-a.cdninstagram.com/hphotos-xaf1/t51.2885-15/e15/914703_878545345505746_1374299063_n.jpg,people  group  music  performance  school  education  man  many  group together  celebration  woman  adult  singer  child  festival  wear  recreation  stock  family  musician,social group  musician
1517276_1445834789003950_218565616_n,679605228,http://scontent-a.cdninstagram.com/hphotos-xpf1/t51.2885-15/e15/1517276_1445834789003950_218565616_n.jpg,sunglasses  people  group  woman  man  adult  recreation  wear  festival  music  vacation  facial expression  portrait  beach  fun  eyewear  three  group together  girl  party,people  spring break
10175089_240349312819846_1894270623_n,679605237,http://scontent-b.cdninstagram.com/hphotos-xfp1/t51.2885-15/e15/10175089_240349312819846_1894270623_n.jpg,nightclub  music  performance  people  bar  stage  musician  nightlife  singer  concert  discotheque  band  man  light  celebration  dancing  group  festival  recreation  club,nightclub  bar  stage  club  music venue
10413215_686445864736846_1669388715_n,679605245,http://scontent-a.cdninstagram.com/hphotos-xpf1/t51.2885-15/e15/10413215_686445864736846_1669388715_n.jpg,man  people  family  couple  friendship  child  boy  adult  recreation  woman  fun  portrait  group together  squad  competition  sport  love  togetherness  elder  group,
927867_539645556142355_1088313401_n,679605273,http://scontent-b.cdninstagram.com/hphotos-xap1/t51.2885-15/e15/927867_539645556142355_1088313401_n.jpg,bill  portrait  people  person  man  retro  card  desktop  symbol  adult  woman  young  face  banner  flag  text  style  sign  paper  famous,poster  text  album cover  advertising  brand
928548_732242380161496_1239756153_n,679605284,http://scontent-b.cdninstagram.com/hphotos-xap1/t51.2885-15/e15/928548_732242380161496_1239756153_n.jpg,baseball  uniform  athlete  outfit  wear  ball  group together  stadium  many  sports equipment  baseball bat  competition  catcher  people  pitcher  one  league  crowd  game  spectator,baseball positions  sports  player  team sport  tennis player  bat and ball games  baseball  catcher  pitcher
10249312_621867231239450_736450550_n,679605332,http://scontent-a.cdninstagram.com/hphotos-xfa1/t51.2885-15/e15/10249312_621867231239450_736450550_n.jpg,money  business  currency  finance  cash  commerce  bank  shopping  wealth  savings  sale  number  dollar  credit  desktop  market  debt  paper  euro  gold piece,food  product  sense  drink
927284_1404761216471489_1993725347_n,679605343,http://scontent-b.cdninstagram.com/hphotos-xpa1/t51.2885-15/e15/927284_1404761216471489_1993725347_n.jpg,people  adult  portrait  man  one  facial expression  wear  indoors  athlete  veil  cap  lid  confidence  son  boy  strength  solo  lifestyle  fine-looking  happiness,face  hair  clothing  red  image  man  male  cap  head  hairstyle  muscle  facial hair  selfie  portrait  headgear
891398_775825299114494_1309032842_n,679604282,http://scontent-b.cdninstagram.com/hphotos-xpf1/t51.2885-15/e15/891398_775825299114494_1309032842_n.jpg,alphabet  illustration  baptismal font  typography  rudiment  picture frame  vector  design  art  margin  type  typographic  graphic  retro  decoration  handwriting  typeset  letter  ornate  disjunct,font  product  picture frame  brand  drawing  pattern  symbol
10349763_217539275122420_580018881_n,679604291,http://scontent-b.cdninstagram.com/hphotos-xpa1/t51.2885-15/e15/10349763_217539275122420_580018881_n.jpg,people  music  man  one  art  concert  adult  war  performance  science  military  public show  no person  offense  portrait  wear  freedom  woman  stage  musician,art  screenshot  anime
925101_433431360118943_1398276830_n,679604301,http://scontent-a.cdninstagram.com/hphotos-xap1/t51.2885-15/e15/925101_433431360118943_1398276830_n.jpg,people  man  indoors  fashion  woman  subway system  music  step  business  portrait  religion  museum  one  street  hallway  adult  wedding  wear  city  church,photograph  black  fashion  design
927798_681970191837615_2120356802_n,679604315,http://scontent-a.cdninstagram.com/hphotos-xap1/t51.2885-15/e15/927798_681970191837615_2120356802_n.jpg,stadium  competition  soccer  people  many  audience  crowd  football  sports fan  game  group together  athlete  man  sport  ball  champion  championship  victory  match  celebration,sports
10387811_644849092256588_1145595098_n,679604356,http://scontent-a.cdninstagram.com/hphotos-xpf1/t51.2885-15/e15/10387811_644849092256588_1145595098_n.jpg,people  city  road  street  adult  group  man  administration  building  military  vehicle  travel  woman  urban  two  wear  home  police  education  recreation,people  vehicle  street  pedestrian  police officer  police  bicycle
1922054_273286282839460_1415491943_n,679604362,http://scontent-a.cdninstagram.com/hphotos-xpa1/t51.2885-15/e15/1922054_273286282839460_1415491943_n.jpg,people  sport  music  woman  bill  man  performance  motion  child  adult  desktop  modern  girl  recreation  active  banner  art  fun  presentation  illustration,player  basketball moves  chinese martial arts
1515358_258807890941690_1881060852_n,679604363,http://scontent-a.cdninstagram.com/hphotos-xfa1/t51.2885-15/e15/1515358_258807890941690_1881060852_n.jpg,people  football  bill  sports fan  competition  action  victory  populace  text  education  banner  event  school  adult  web  award  goal  champion  athlete  soccer,basketball moves  player  team  cheering  stadium
928257_241392049400674_893111123_n,679604370,http://scontent-b.cdninstagram.com/hphotos-xap1/t51.2885-15/e15/928257_241392049400674_893111123_n.jpg,people  public show  event  many  audience  festival  crowd  band  city  group  celebration  performance  man  ceremony  concert  flag  music  stage  competition  spectator,
1390297_587398284659224_814894027_n,679604385,http://scontent-b.cdninstagram.com/hphotos-xfp1/t51.2885-15/e15/1390297_587398284659224_814894027_n.jpg,football  competition  athlete  stadium  game  uniform  soccer  man  coaching  football player  people  wear  outfit  action  adult  championship  sports equipment  quarterback  helmet  match,player  football player  gridiron football  american football  sports  soccer  baseball positions  football equipment and supplies
10175223_547396998710246_359727440_n,679604395,http://scontent-b.cdninstagram.com/hphotos-xap1/t51.2885-15/e15/10175223_547396998710246_359727440_n.jpg,template  navigation  set  stripe  site  World Wide Web  menu (food)  page  layout  vectors  banner  user  login  vector  internet  label  interface  no person  arrow  presentation,text  font  product  web page  screenshot  multimedia  diagram  brand  document  presentation
925691_1448572695369031_1121578965_n,679604441,http://scontent-b.cdninstagram.com/hphotos-xpa1/t51.2885-15/e15/925691_1448572695369031_1121578965_n.jpg,Christmas  traditional  celebration  winter  no person  people  decoration  vacation  outdoors  fun  summer  woman  festival  child  gift  vertical  flower  religion  thread  christmas tree,flower  spring  food  sweetness  flavor
1517034_544489492314477_694405967_n,679604446,http://scontent-a.cdninstagram.com/hphotos-xap1/t51.2885-15/e15/1517034_544489492314477_694405967_n.jpg,light  music  performance  no person  people  concert  laser  electro  technology  nightclub  rave  festival  musician  casino  vehicle  transportation system  evening  club  auto racing  venue,stage  screenshot  nightclub
10358313_240086316192215_2061454183_n,679604450,http://scontent-b.cdninstagram.com/hphotos-xap1/t51.2885-15/e15/10358313_240086316192215_2061454183_n.jpg,man  brawny  fine-looking  strength  fitness  exercise  sport  influencer  strong  muscle  isolated  adult  bodybuilding  guy  athlete  people  young  fist  one  portrait,muscle  sculpture  arm  statue
1527544_190021751198754_1129006524_n,679604483,http://scontent-b.cdninstagram.com/hphotos-xfp1/t51.2885-15/e15/1527544_190021751198754_1129006524_n.jpg,portrait  people  adult  two  man  facial expression  love  wear  woman  affection  one  music  embrace  interaction  girl  son  musician  intimacy  singer  child,face  image  black and white  nose  photography  darkness  organ  eye  emotion  hand  interaction  portrait  monochrome photography
926599_628403380543792_2037184323_n,679604500,http://scontent-a.cdninstagram.com/hphotos-xpa1/t51.2885-15/e15/926599_628403380543792_2037184323_n.jpg,stadium  baseball  competition  football  sports fan  venue  soccer  athlete  bleachers  spectator  game  ball  outfit  grandstand  vehicle  no person  ice hockey  many  audience  baseball bat,structure  transport  stadium  sport venue  display device  arena  vehicle  public transport  scoreboard  signage
927810_1450797435139079_1422271823_n,679604544,http://scontent-a.cdninstagram.com/hphotos-xap1/t51.2885-15/e15/927810_1450797435139079_1422271823_n.jpg,child  people  woman  family  love  man  two  togetherness  son  three  boy  little  fun  adolescent  indoors  affection  cute  girl  isolated  battle,hair  human action  hairstyle  interaction  kiss  romance  selfie
10268863_1600805746810269_354747193_n,679604568,http://scontent-b.cdninstagram.com/hphotos-xpa1/t51.2885-15/e15/10268863_1600805746810269_354747193_n.jpg,recreation  fun  action  man  people  sport  hurry  leisure  competition  sky  skateboard  skate  adult  silhouette  lifestyle  outdoors  balance  light  motion  park,boardsport  wakeboarding  sports equipment  sports  snowboarding  extreme sport  skateboarding
10005211_1395367084075039_969197832_n,679604583,http://scontent-a.cdninstagram.com/hphotos-xfp1/t51.2885-15/e15/10005211_1395367084075039_969197832_n.jpg,people  one  dog  outdoors  snow  recreation  water  travel  woman  mammal  no person  canine  beach  adult  sunset  winter  man  two  landscape  sky,blue  sea  ocean  arctic
1208285_448250808631736_356494614_n,679604586,http://scontent-b.cdninstagram.com/hphotos-xpa1/t51.2885-15/e15/1208285_448250808631736_356494614_n.jpg,competition  man  people  action  championship  helmet  adult  football  athlete  uniform  game  stadium  International  victory  protection  champion  squad  sport  motion  university,gridiron football  american football  player  sports  soccer  tackle
10358260_305363032972294_1818676670_n,679604606,http://scontent-a.cdninstagram.com/hphotos-xap1/t51.2885-15/e15/10358260_305363032972294_1818676670_n.jpg,action  exhilaration  water sports  recreation  hurry  surf  adventure  fun  sport  motion  kite  skill  competition  parachute  surfboarding  adrenaline  jump  sea  leisure  fast,sports  water sport  boating  wind wave  boardsport  vehicle  extreme sport  wakeboarding  powerboating  wave  surfing equipment and supplies  kitesurfing
1527743_220326324818145_1689011936_n,679604612,http://scontent-a.cdninstagram.com/hphotos-xpf1/t51.2885-15/e15/1527743_220326324818145_1689011936_n.jpg,group  group together  friendship  many  woman  people  child  girl  fun  adolescent  school  man  multicultural  wear  adult  togetherness  enjoyment  facial expression  student  class,people  fashion  audience  musical theatre
1799552_407694399367516_1968350275_n,679604620,http://scontent-a.cdninstagram.com/hphotos-xpa1/t51.2885-15/e15/1799552_407694399367516_1968350275_n.jpg,radiography  diagnosis  medicine  hospital  scrutiny  technology  surgery  healthcare  radiology  indoors  no person  patient  science  people  doctor  ultrasound  scanning  test  laboratory  health,color  image  picture frame  display device  interior design  advertising  design  brand  window covering
1598945_258112354357911_1627289123_n,679604624,http://scontent-b.cdninstagram.com/hphotos-xpa1/t51.2885-15/e15/1598945_258112354357911_1627289123_n.jpg,design  desktop  abstract  texture  shape  wallpaper  no person  image  pattern  symbol  illustration  fabric  fashion  love  decoration  color  graphic  round  art  retro,art  circle  pattern  shape
926756_308907372600575_1065786741_n,679604626,http://scontent-a.cdninstagram.com/hphotos-xpa1/t51.2885-15/e15/926756_308907372600575_1065786741_n.jpg,signal  signalise  road  text  no person  box  warning  business  street  transportation system  logo  information  emergency  signage  offense  sign  commerce  traffic  container  caveat,sign  vehicle  signage  advertising  banner
