fname,media_id,url,clarifai_labels,google_labels
1170985_183101875214360_545100313_n,679604529,http://scontent-b.cdninstagram.com/hphotos-xfp1/t51.2885-15/e15/1170985_183101875214360_545100313_n.jpg,people  portrait  one  adult  wear  lid  man  cap  veil  outfit  leader  outerwear  ceremony  facial expression  side view  graduation  facial hair  education  jacket  menswear,person  image  abbot  military officer  facial hair  portrait  profession  clergy
10004336_369587869846437_680623576_n,679604530,http://scontent-b.cdninstagram.com/hphotos-xpf1/t51.2885-15/e15/10004336_369587869846437_680623576_n.jpg,people  athlete  strength  man  brawny  shirtless  torso  tattoo  strong  nude  adult  thorax  muscle  influencer  bodybuilding  biceps  abdomen  person  exercise  fitness,barechestedness  muscle  male  arm  bodybuilding  finger  wrestler  organ  leg  hand  sense  abdomen  human body  trunk  chest  biceps curl
1516836_330669647071463_1735103527_n,679604534,http://scontent-b.cdninstagram.com/hphotos-xaf1/t51.2885-15/e15/1516836_330669647071463_1735103527_n.jpg,conceptual  business  text  desktop  education  medicine  designing  research  no person  facts  illustration  science  abstract  knowledge  time  cloud  achievement  graphic  creativity  typographic,text  line  font  shape  brand  document  diagram  presentation
10413798_321254004732321_370989405_n,679604537,http://scontent-a.cdninstagram.com/hphotos-xap1/t51.2885-15/e15/10413798_321254004732321_370989405_n.jpg,child  woman  adolescent  cute  people  indoors  fun  pretty  joy  horizontal  enjoyment  looking  laughing  vertical  relaxation  portrait  innocence  fashion  happiness  headshot,hair  human hair color  facial expression  face  human action  nose  red  person  smile  mouth  hairstyle  blond  lip  head  skin  brown hair  organ  eye  selfie  glasses
1389151_588664154515001_458210409_n,679604538,http://scontent-b.cdninstagram.com/hphotos-xaf1/t51.2885-15/e15/1389151_588664154515001_458210409_n.jpg,wear  fashion  man  leather  no person  one  people  outerwear  jacket  art  style  gloves  military  adult  dress  weapon  portrait  design  winter  uniform,clothing  leather  jacket  outerwear  textile  material
10431847_1425765974376780_1276913185_n,679604540,http://scontent-a.cdninstagram.com/hphotos-xpf1/t51.2885-15/e15/10431847_1425765974376780_1276913185_n.jpg,hand  cheese  food  people  pizza  desktop  woman  tomato  lunch  outdoors  meal  soil  dinner  old  person  ground  junk  adult  leaf  wall,human action  food  hand  sense  meal
1741772_426363824164581_825136268_n,679604834,http://scontent-b.cdninstagram.com/hphotos-xpa1/t51.2885-15/e15/1741772_426363824164581_825136268_n.jpg,people  silhouette  beach  woman  girl  yoga  sea  sun  sunset  sport  shadow  nature  one  ocean  body  adult  fitness  model  exercise  sky,black  black and white  human positions  image  sitting  monochrome photography  photography  monochrome  arm  wing  physical fitness
1169277_233501433475614_1400839813_n,679604565,http://scontent-b.cdninstagram.com/hphotos-xap1/t51.2885-15/e15/1169277_233501433475614_1400839813_n.jpg,collection  fashion  model  fashionable  music  festival  band  performance  man  group  punk  group together  stage  concert  wear  presentation  portrait  musician  singer  public show,musician  audience  fashion
1971328_1447769978791188_871568622_n,679604566,http://scontent-b.cdninstagram.com/hphotos-xaf1/t51.2885-15/e15/1971328_1447769978791188_871568622_n.jpg,text  conceptual  illustration  squad  bill  business  graphic  facts  management  internet  communication  strategy  cloud  research  infection  leadership  stylized  newspaper  spherical  desktop,advertising  poster  banner  brand  presentation
925852_695131217200397_1991693031_n,679604570,http://scontent-a.cdninstagram.com/hphotos-xpa1/t51.2885-15/e15/925852_695131217200397_1991693031_n.jpg,car  vehicle  transportation system  automotive  drive  fast  wheel  speed  race  sedan  no person  coupe  chrome  truck  road  power  traffic  hurry  engine  classic,car  motor vehicle  vehicle  land vehicle  automotive design  automotive exterior  wheel  automobile make  pickup truck  bumper  model car  chevrolet silverado  muscle car  rim  stock car racing  truck
1389317_236667539830384_1848280851_n,679604574,http://scontent-a.cdninstagram.com/hphotos-xfp1/t51.2885-15/e15/1389317_236667539830384_1848280851_n.jpg,text  illustration  vintage  bill  retro  paper  old  label  print  picture frame  no person  calligraphy  antique  margin  banner  document  sign  vertical  victorian  people,font  advertising  logo  brand  label  trademark
1173058_542327529184482_1388920668_n,679604577,http://scontent-a.cdninstagram.com/hphotos-xaf1/t51.2885-15/e15/1173058_542327529184482_1388920668_n.jpg,illustration  portrait  people  man  bill  adult  vertical  art  person  actor  famous  tattoo  collection  vintage  collage  danger  desktop  music  war  text,comic book  poster  album cover  muscle  action film  comics
1941065_246728092166343_627541572_n,679604588,http://scontent-a.cdninstagram.com/hphotos-xpf1/t51.2885-15/e15/1941065_246728092166343_627541572_n.jpg,woman  people  adult  two  man  wear  portrait  indoors  fashion  lid  facial expression  girl  enjoyment  outdoors  couple  love  dress  evening  brunette  shopping,photograph  clothing  image  person  fun  lady  girl  man  muscle  singing  model  glasses  photo shoot
926163_238475999609544_818091359_n,679604592,http://scontent-a.cdninstagram.com/hphotos-xap1/t51.2885-15/e15/926163_238475999609544_818091359_n.jpg,people  woman  man  adult  sport  celebration  squad  party  event  fun  competition  fashion  bill  person  dancing  young  performance  portrait  love  wear,professional wrestling  sports  wrestler  wrestling
1168713_284779705023881_1912072968_n,679604599,http://scontent-a.cdninstagram.com/hphotos-xap1/t51.2885-15/e15/1168713_284779705023881_1912072968_n.jpg,car  transportation system  headlight  speed  hurry  road  wheel  fast  drive  vehicle  taillight  asphalt  sedan  automotive  traffic  windshield  power  coupe  hood  race,car  vehicle  land vehicle  sports car  automotive design  automotive exterior  wheel  supercar  automobile make  bumper  screenshot
1690150_299602373522156_858174095_n,679604603,http://scontent-b.cdninstagram.com/hphotos-xap1/t51.2885-15/e15/1690150_299602373522156_858174095_n.jpg,design  retro  art  old  vintage  vehicle  tattoo  symbol  pattern  antique  decoration  culture  iron  transportation system  style  no person  exhibition  traditional  classic  steel,tattoo  arm  art  tattoo artist  human body  chest
1527659_446956305426213_1887747987_n,679604611,http://scontent-b.cdninstagram.com/hphotos-xpf1/t51.2885-15/e15/1527659_446956305426213_1887747987_n.jpg,template  form  World Wide Web  page  layout  site  set  label  navigation  menu (food)  presentation  vectors  banner  stripe  login  restaurant check  interface  sandbank  number  diagram,web page  font  product  line  brand  document  diagram  screenshot  multimedia  presentation
10354445_244896429035166_1212943456_n,679604615,http://scontent-b.cdninstagram.com/hphotos-xpa1/t51.2885-15/e15/10354445_244896429035166_1212943456_n.jpg,people  adult  group  man  woman  wear  group together  police  administration  offense  music  military  child  portrait  outfit  education  movie  five  war  four,person  people
927616_1426406847617659_851245365_n,679604617,http://scontent-b.cdninstagram.com/hphotos-xpa1/t51.2885-15/e15/927616_1426406847617659_851245365_n.jpg,people  group  man  adult  group together  woman  wear  restaurant  many  meeting  indoors  education  exhibition  party  several  chair  business  music  school  administration,social group  team  meal
914269_1415529415353057_1157377955_n,679604627,http://scontent-b.cdninstagram.com/hphotos-xfa1/t51.2885-15/e15/914269_1415529415353057_1157377955_n.jpg,computer  laptop  internet  screen  technology  electronics  keyboard  wireless  display  no person  portable  monitor  touch  business  contemporary  data  connection  World Wide Web  modern  machinery,laptop  display device  computer hardware  technology  electronic device  computer monitor  personal computer  computer program  multimedia  gadget  netbook
1389658_1377194012528143_692430599_n,679604632,http://scontent-a.cdninstagram.com/hphotos-xpa1/t51.2885-15/e15/1389658_1377194012528143_692430599_n.jpg,people  man  woman  adult  competition  group  portrait  sport  recreation  group together  battle  fun  wear  music  boy  friendship  football  populace  child  athlete,sports  advertising  wrestling
1170182_228770783983070_1272053521_n,679604635,http://scontent-b.cdninstagram.com/hphotos-xpa1/t51.2885-15/e15/1170182_228770783983070_1272053521_n.jpg,portrait  man  one  adult  people  looking  athlete  strength  serious  person  wear  strong  young  business  fine-looking  monochrome  guy  face  beard  indoors,black  black and white  player  monochrome  monochrome photography
1599503_1451912825023329_1334289065_n,679604639,http://scontent-b.cdninstagram.com/hphotos-xpa1/t51.2885-15/e15/1599503_1451912825023329_1334289065_n.jpg,symbol  business  man  human  desktop  hand  celebration  design  no person  decoration  gift  head  love  people  traditional  image  wedding  color  sign  isolate,white  clothing  font
1391396_777751625572564_185783933_n,679604643,http://scontent-a.cdninstagram.com/hphotos-xpa1/t51.2885-15/e15/1391396_777751625572564_185783933_n.jpg,people  adult  outdoors  horizontal  portrait  man  vertical  sport  woman  fun  child  headshot  side view  fair weather  enjoyment  contemplation  water  individuality  relaxation  confidence,biology
10009793_642772679124511_1454320115_n,679604668,http://scontent-a.cdninstagram.com/hphotos-xpf1/t51.2885-15/e15/10009793_642772679124511_1454320115_n.jpg,fashion  modern  no person  business  jacket  bag  design  wear  isolated  shopping  style  leather  casual  man  contemporary  shirt  desktop  luggage  accessory  elegant,clothing  black  jacket  outerwear  pattern  design  cap  mesh  leather
1799641_552311341542907_461158312_n,679604673,http://scontent-b.cdninstagram.com/hphotos-xap1/t51.2885-15/e15/1799641_552311341542907_461158312_n.jpg,abdomen  stomach  maternity  woman  adult  girl  body  people  anticipation  midsection  motherhood  underwear  birth  pantie  navel  belly  love  sexy  bikini  nude,clothing  undergarment  thigh  blond  muscle  mouth  active undergarment  finger  leg  hand  abdomen  thumb
10413830_393405674134501_267759771_n,679604676,http://scontent-a.cdninstagram.com/hphotos-xfp1/t51.2885-15/e15/10413830_393405674134501_267759771_n.jpg,athlete  competition  basketball  soccer  adult  people  wear  football  one  man  portrait  sports equipment  indoors  ball  action  stadium  motion  school  recreation  outfit,football player  sports  player  basketball  basketball moves  soccer
10011208_296938490463456_90618295_n,679604679,http://scontent-a.cdninstagram.com/hphotos-xfp1/t51.2885-15/e15/10011208_296938490463456_90618295_n.jpg,surf  surfboarding  action  water  spray  splash  water sports  recreation  sea  ocean  swell  sport  wave  adventure  beach  adrenaline  exhilaration  hurry  fun  motion,surfing  wind wave  sports  water sport  wave  boardsport  surfboard  surface water sports  ocean  surfing equipment and supplies  individual sports  extreme sport  bodyboarding  sea
10311054_797200566970277_1743876922_n,679604684,http://scontent-a.cdninstagram.com/hphotos-xpf1/t51.2885-15/e15/10311054_797200566970277_1743876922_n.jpg,people  group  woman  adult  man  many  music  election  bar  portrait  rap  several  nightclub  performance  wear  enjoyment  musician  party  facial expression  celebration,photograph  people  nightclub
10453678_1505719929641109_1514091697_n,679604685,http://scontent-a.cdninstagram.com/hphotos-xap1/t51.2885-15/e15/10453678_1505719929641109_1514091697_n.jpg,golf  one  swing  people  golfer  competition  recreation  outdoors  leisure  child  golf club  adult  park  boy  man  daylight  game  portrait  action  ball,golfer  outdoor recreation  golf  recreation  professional golfer  fourball
10387930_447228468747525_1831738573_n,679604687,http://scontent-a.cdninstagram.com/hphotos-xap1/t51.2885-15/e15/10387930_447228468747525_1831738573_n.jpg,woman  people  man  portrait  two  love  young  couple  family  happiness  adult  togetherness  joy  child  smile  friendship  beautiful  fun  bill  person,art  album cover  selfie  modern art
914614_1468749153339628_1394524814_n,679604688,http://scontent-a.cdninstagram.com/hphotos-xfa1/t51.2885-15/e15/914614_1468749153339628_1394524814_n.jpg,text  business  paper  strategy  invention  education  communication  facts  page  achievement  knowledge  management  designing  solution  accomplishment  research  information  data  company  leadership,text  font  line  brand  shape  document  presentation  writing
10362106_1415451942073170_239263977_n,679604693,http://scontent-a.cdninstagram.com/hphotos-xap1/t51.2885-15/e15/10362106_1415451942073170_239263977_n.jpg,technology  illustration  abstract  design  creativity  template  desktop  shape  color  card  round  graphic  art  computer  wallpaper  modern  image  internet  data  energy,color  text  purple  font  eye  organ  circle  magenta  human body
1168554_246065342225527_34573263_n,679604696,http://scontent-a.cdninstagram.com/hphotos-xaf1/t51.2885-15/e15/1168554_246065342225527_34573263_n.jpg,fashion  woman  sexy  pretty  glamour  young  girl  elegant  retro  model  style  contemporary  cute  beautiful  adolescent  hair  long  erotic  one  wear,clothing  footwear  arm  leg  thigh  human body  photo shoot  trousers  abdomen
1172429_1381011988786123_1563717132_n,679604701,http://scontent-a.cdninstagram.com/hphotos-xpa1/t51.2885-15/e15/1172429_1381011988786123_1563717132_n.jpg,group  group together  people  woman  man  adult  portrait  many  school  music  education  friendship  band  wear  facial expression  child  singer  five  recreation  happiness,social group  people  youth
926028_539055156189964_526864379_n,679604708,http://scontent-a.cdninstagram.com/hphotos-xap1/t51.2885-15/e15/926028_539055156189964_526864379_n.jpg,isolated  no person  disjunct  leather  wear  fashion  desktop  winter  stranded  design  safety  symbol  protection  illustration  sport  horizontal  headwear  equipment  retro  ball,clothing  protective equipment in gridiron football  football equipment and supplies  football helmet  cap  ball  sports equipment  protective gear in sports
1737479_211669795697778_631434959_n,679604728,http://scontent-a.cdninstagram.com/hphotos-xpf1/t51.2885-15/e15/1737479_211669795697778_631434959_n.jpg,mammal  pet  dog  cage  cute  animal  canine  no person  puppy  portrait  sit  fur  looking  one  little  funny  friendship  young  adorable  two,dog  mammal  animal shelter  dog crate  dog like mammal  cage
1661532_658002327578731_1290687546_n,679604730,http://scontent-a.cdninstagram.com/hphotos-xaf1/t51.2885-15/e15/1661532_658002327578731_1290687546_n.jpg,vertical  outdoors  horizontal plane  people  illuminated  illustration  business  horizontal  text  adult  city  headlight  silhouette  sport  shadow  light  danger  street  man  transportation system,phenomenon  weather  screenshot
1527509_719848974715529_890016726_n,679604748,http://scontent-b.cdninstagram.com/hphotos-xpf1/t51.2885-15/e15/1527509_719848974715529_890016726_n.jpg,woman  bikini  sport  body  adult  fitness  health  exercise  recreation  people  sexy  slender  strength  summer  effort  leisure  club  athlete  underwear  energy,human action  clothing  image  muscle  finger  arm  selfie  abdomen  hand  sense  human body  trunk  thumb  chest
1516380_717480988307916_1423925315_n,679604749,http://scontent-a.cdninstagram.com/hphotos-xap1/t51.2885-15/e15/1516380_717480988307916_1423925315_n.jpg,adult  woman  people  group  furniture  man  commerce  room  education  indoors  wear  child  two  recreation  stock  healthcare  many  facial expression  enjoyment  several,play
10369313_1421141298161531_1414989271_n,679604767,http://scontent-b.cdninstagram.com/hphotos-xpf1/t51.2885-15/e15/10369313_1421141298161531_1414989271_n.jpg,people  skateboard  competition  chair  man  adult  motion  skate  recreation  fun  seat  woman  performance  furniture  skater  audience  jumping  hurry  exhibition  vehicle,sports  skateboarding  extreme sport  bicycle motocross  skateboarding equipment and supplies  skateboard  boardsport
10269026_311835732302708_2073751039_n,679604768,http://scontent-b.cdninstagram.com/hphotos-xpa1/t51.2885-15/e15/10269026_311835732302708_2073751039_n.jpg,people  adult  one  man  woman  two  group  group together  military  wear  vehicle  indoors  many  three  grinder  several  room  four  coffee  transportation system,photograph  black and white  image  monochrome photography  monochrome
1725687_720109711356684_765842261_n,679604779,http://scontent-b.cdninstagram.com/hphotos-xap1/t51.2885-15/e15/1725687_720109711356684_765842261_n.jpg,woman  sexy  adult  recreation  fitness  people  award  elegant  strength  one  wear  leisure  fashion  shape  figure  young  health  exercise  effort  thinning,human action  person  muscle  arm  physical fitness  physical exercise
1922272_535776546529969_702026923_n,679604785,http://scontent-a.cdninstagram.com/hphotos-xfa1/t51.2885-15/e15/1922272_535776546529969_702026923_n.jpg,people  two  man  portrait  adult  facial expression  wear  monochrome  eyewear  three  affection  interaction  woman  group  togetherness  furniture  music  embrace  one  love,photograph  black and white  person  people  man  photography  male  monochrome photography  monochrome  glasses  gentleman  eyewear  interaction
914712_648892831848232_634145533_n,679604789,http://scontent-b.cdninstagram.com/hphotos-xaf1/t51.2885-15/e15/914712_648892831848232_634145533_n.jpg,people  man  tattoo  adult  portrait  athlete  competition  fashion  one  model  girl  woman  rap  sunglasses  wear  offense  football  battle  lid  music,hair  person  man  male  facial hair  arm  hairstyle  glasses  muscle  eyewear  moustache  tattoo  hand  beard  vision care  cool  selfie  chest
926925_196642147191293_1572197731_n,679604817,http://scontent-a.cdninstagram.com/hphotos-xap1/t51.2885-15/e15/926925_196642147191293_1572197731_n.jpg,people  wear  uniform  competition  man  adult  military  recreation  outfit  athlete  ice hockey  child  soccer  school  many  game  woman  group together  stock  sports fan,
928077_637215862984295_236499303_n,679604818,http://scontent-b.cdninstagram.com/hphotos-xap1/t51.2885-15/e15/928077_637215862984295_236499303_n.jpg,woman  girl  portrait  fashion  people  model  sexy  one  pretty  glamour  adult  blond  eye  dress  cute  hair  lingerie  indoors  lips  wear,hair  person  woman  lady  photography  girl  beauty  brown hair  blond  portrait  model  fashion  photo shoot  sense  hand  portrait photography
1741361_1471404019750222_1413143806_n,679604831,http://scontent-b.cdninstagram.com/hphotos-xpf1/t51.2885-15/e15/1741361_1471404019750222_1413143806_n.jpg,vertical  people  portrait  adult  monochrome  illustration  art  man  individuality  woman  indoors  headshot  attitude  fur coat  horizontal  beard  contemplation  side view  bizarre  sadness,hair  text  image  album cover  font  hairstyle  poster  emotion  presentation
10354318_472089606255054_1389737676_n,679604833,http://scontent-b.cdninstagram.com/hphotos-xpa1/t51.2885-15/e15/10354318_472089606255054_1389737676_n.jpg,image  symbol  illustration  business  desktop  design  isolated  round  vector  sign  no person  shape  handle  designing  graphic  silhouette  art  round out  travel  disjunct,product  furniture
1209506_664012906953961_1196335934_n,679604835,http://scontent-a.cdninstagram.com/hphotos-xpa1/t51.2885-15/e15/1209506_664012906953961_1196335934_n.jpg,tree  house  wood  snow  winter  window  furniture  no person  chair  seat  family  table  light  bench  nature  room  home  landscape  patio  cold,snow  weather  house  wall  winter  home  season  flower
10004078_476113402517719_2081243401_n,679604844,http://scontent-a.cdninstagram.com/hphotos-xpa1/t51.2885-15/e15/10004078_476113402517719_2081243401_n.jpg,portrait  people  face  old  man  one  head  adult  art  religion  horror  culture  ancient  fear  leader  sculpture  facial hair  vicious  symbol  monochrome,head  art  carving  drawing  sketch  tattoo artist
10413963_291819490996116_1221769374_n,679604852,http://scontent-a.cdninstagram.com/hphotos-xap1/t51.2885-15/e15/10413963_291819490996116_1221769374_n.jpg,no person  dark  horizontal  creativity  desktop  text  sky  people  typographic  business  conceptual  achievement  chalk  outdoors  education  illustration  internet  disjunct  cloud  designing,text  font  brand  screenshot  line  presentation
926447_774134682596832_177941147_n,679604868,http://scontent-a.cdninstagram.com/hphotos-xpa1/t51.2885-15/e15/926447_774134682596832_177941147_n.jpg,people  art  religion  illustration  symbol  book  god  no person  belief  holy  color  Halloween  performance  spirituality  man  ghost  travel  saint  festival  painting,toy  action figure  comics  figurine
1738518_594617987287335_578518497_n,679604869,http://scontent-b.cdninstagram.com/hphotos-xfa1/t51.2885-15/e15/1738518_594617987287335_578518497_n.jpg,text  business  typographic  cloud  abstract  conceptual  internet  definition  desktop  education  disjunct  resource  creativity  medicine  management  designing  achievement  symbol  energy  communication,text  font  line  brand  shape  presentation
1391288_1410465059185799_1384632525_n,679604872,http://scontent-b.cdninstagram.com/hphotos-xpa1/t51.2885-15/e15/1391288_1410465059185799_1384632525_n.jpg,template  World Wide Web  layout  banner  booklet  label  set  page  presentation  navigation  card  information  menu (food)  menu  diagram  wheel  heading  theme  arrow  design,text  cartoon  product  brand  presentation
10013050_1400922496848446_342452095_n,679604900,http://scontent-b.cdninstagram.com/hphotos-xfa1/t51.2885-15/e15/10013050_1400922496848446_342452095_n.jpg,people  woman  group  adult  portrait  man  monochrome  group together  scared  family  business  fear  three  isolated  actor  young  two  wear  retro  child,photograph  black and white  photography  album cover  monochrome photography  eyewear  moustache  brand  gentleman
1389760_1428026894079242_537781426_n,679604919,http://scontent-a.cdninstagram.com/hphotos-xap1/t51.2885-15/e15/1389760_1428026894079242_537781426_n.jpg,hurry  sport  balance  air  recreation  fun  danger  board  action  competition  appoint  trick (work)  skateboard  ramp  man  skate  wood  jump  active  exercise,snowboard  sports equipment  extreme sport  surfing equipment and supplies  advertising  surfboard
1599964_515865498526895_34919326_n,679604923,http://scontent-b.cdninstagram.com/hphotos-xpa1/t51.2885-15/e15/1599964_515865498526895_34919326_n.jpg,people  person  famous  pop  talent  entertainment  tattoo  adult  event  man  popularity  sunglasses  one  fame  eyeglasses  portrait  eyewear  offense  face  shirtless,face  tattoo  arm  head  facial hair  tattoo artist  human body  chest  drawing
1208430_772278786131102_2137407047_n,679604928,http://scontent-b.cdninstagram.com/hphotos-xap1/t51.2885-15/e15/1208430_772278786131102_2137407047_n.jpg,mammal  sheep  people  one  adult  two  deer  goat  child  livestock  woman  farm  wildlife  man  zoo  outdoors  portrait  no person  cattle  indoors,mammal  deer
1598667_423131804484296_192965196_n,679604937,http://scontent-a.cdninstagram.com/hphotos-xap1/t51.2885-15/e15/1598667_423131804484296_192965196_n.jpg,people  man  body  skin  human  person  tattoo  adult  portrait  woman  desktop  color  hand  back  fashion  one  isolated  model  nude  beautiful,arm  tattoo  muscle  organ  leg  sense  hand  thigh  human body  chest
914556_621442181243778_1311712212_n,679604953,http://scontent-a.cdninstagram.com/hphotos-xaf1/t51.2885-15/e15/914556_621442181243778_1311712212_n.jpg,boxer  competition  adult  people  many  athlete  combat  aggression  gloves  one  sports equipment  martial arts  two  group together  ring  man  jewelry band  battle  fighter  portrait,sports  wrestling  professional wrestling  entertainment  contact sport  wrestler  combat sport  puroresu  individual sports
10175148_629477240470702_230800363_n,679604976,http://scontent-a.cdninstagram.com/hphotos-xaf1/t51.2885-15/e15/10175148_629477240470702_230800363_n.jpg,woman  people  portrait  adult  fashion  recreation  model  music  one  indoors  wear  girl  performance  movie  brunette  exhibition  athlete  facial expression  musician  dress,human action  image  person  lady  girl  muscle  arm  thigh  leg  photo shoot  model  abdomen  human body  trunk
10254323_706141302780073_1567081454_n,679604997,http://scontent-b.cdninstagram.com/hphotos-xpf1/t51.2885-15/e15/10254323_706141302780073_1567081454_n.jpg,man  people  adult  portrait  vertical  business  fine-looking  text  horizontal  strength  determination  serious  indoors  conceptual  attitude  communication  headshot  danger  achievement  looking,mouth  muscle  album cover  sense  emotion
1963166_200922550118032_1763015695_n,679605005,http://scontent-b.cdninstagram.com/hphotos-xpa1/t51.2885-15/e15/1963166_200922550118032_1763015695_n.jpg,banner  bill  people  card  illustration  paper  sign  woman  symbol  horizontal  portrait  business  identity  blank  adult  desktop  vector  text  patriotism  vertical,text  advertising  brand  presentation  album cover
